Text,Label
Bữa tiệc đáng nhớ tại Nhà hàng Hải sản,5
Bữa tiệc sinh nhật đáng nhớ,5
Bữa tiệc tuyệt vời,5
Bữa tối lãng mạn,5
Bữa tối ngon miệng,5
Bữa tối rất tuyệt vời,5
Bữa trưa quá tuyệt vời,5
Bữa trưa thật tuyệt vời,5
Bữa trưa tuyệt vời cùng gia đình tại La vela,5
Bữa trưa xuất sắc,5
Bữa trưa ý nghĩa cùng bạn tôi,5
Bữa trưa ý nghĩa cùng gia đình,5
Cà phê ngon,5
Cà phê ngon nhất trong thị trấn,5
"Cà phê ngon, khách sạn đẹp",5
"Các bạn nhân viên rất chu đáo, nhiệt tình và vui vẻ",5
Các nhân viên thật tuyệt vời,5
Cách ly rất tốt ở khách sạn này,5
Cafe bên cạnh bể bơi rất tuyệt,5
Cái gì cũng tốt,5
Cái nhìn đầu tiên tuyệt vời,5
cảm giác bất ngờ,5
Cám ơn bạn tuyền và huyền đã hỗ trợ gia đình chúng tôi rất nhiều,4
"Cảm ơn khách sạn, gia đình tôi đã có kỳ nghỉ tuyệt vời ở đây.",5
Cảm ơn nhân viên vinpearl đã cho tôi cảm giác thân quen đến vậy.,5
Cảm ơn rất nhiều,4
Cảm ơn sự nhiệt tình,4
Cảm ơn tất cả mọi người,4
"Cảm ơn vì đã hỗ trợ chúng em chuyến đi này, tuyệt vời lắm ạ",5
Cảm thấy hài lòng,5
Cảm thấy rất hài lòng về món ăn lẫn địa điểm ăn rất đẹp và lịch sự,5
Cảm thấy rất tốt,5
Cảm thấy vui vẻ và thoải mái,5
Cảnh biển đẹp và nhân viên rất thân thiện,5
Cảnh đẹp,5
Cảnh đẹp,5
"Cảnh đẹp lãng mạn, yên bình, tuyệt vời để nghỉ dưỡng và không gian lãng mạn cho những cặp đôi",5
Cảnh đẹp tuyệt vời,5
"Cảnh đẹp, phòng nghỉ tiện nghi",5
"Cảnh quan đẹp, nhân viên tốt và nhiệt tình",5
Cảnh quan khách sạn,5
"Cảnh quan thật đẹp, nhân viên dễ thương và nhiệt tình.",5
"Cảnh quang đẹp, phòng đẹp, nhân viên nhiệt tình, hòa nhã, dễ thương",5
Cảnh tắm bùn rất đẹp,5
"Cảnh thiên nhiên rất đẹp, thoải mái dễ chịu",5
Cảnh thiên nhiên view hồ quá đẹp,5
Cặp đôi độc thân,5
Cầu hôn,3
Chào đón người yêu bay từ Huế vào,3
Chào đón nhiệt tình,4
Chắc chắn là một trong những khách sạn tốt nhất ở Hà Nội,5
Chăm sóc dịch vụ tuyệt vời,5
Chăm sóc hậu mãi tốt,5
Chẳng thể tả nổi quá tuyệt vời,5
Chấp nhận được,5
Chất lượng,5
"Chất lượng , giá phải chăng",5
Chất lượng 10 điểm,5
Chất lượng 5 sao,5
chất lượng 5 sao.,5
chất lượng bình thường,4
chất lượng cao,5
Chất lượng của khách sạn tuyệt vời,4
Chất lượng dịch vụ,5
Chất lượng dịch vụ đẳng cấp 5 sao,5
Chất lượng dịch vụ hoàn hảo,5
Chất lượng dịch vụ quá tuyệt vời,5
Chất lượng dịch vụ rất tốt,5
Chất lượng dịch vụ tạm ổn,5
Chất lượng dịch vụ tốt,5
Chất lượng dịch vụ tuyệt vời,5
Chất lượng dịch vụ và chăm sóc,3
Chất lượng dịch vụ và tiện ích quá thấp so với giá tiền.,2
chất lượng giảm so với các năm trước,2
CHẤT LƯỢNG HOÀN HẢO,5
Chất lượng khá tương xứng với giá tiền,4
Chất lượng nha.,4
Chất lượng nội thất đang xuống cấp,2
"Chất lượng ok, staff ổn, dịch vụ ổn",4
"Chất lượng phục vụ , vệ sinh",3
Chất lượng phục vụ tốt,5
Chất lượng rất tốt.,5
"chất lượng tốt, phục vụ chu đáo, nhiệt tình. dịch vụ tiện nghi, thoải mái.",5
Chất lượng tuyệt vời,5
"Chất lượng tuyệt vời, nhân viên nhiệt tình",5
Chất lượng và dịch vụ tại Vinpearl nha trang bay,3
Chất lượng và giá hợp lý,5
Chất lượng và giá trị,3
Chất lượng và phục vụ,3
Chất lượng xứng đáng 5 sao,5
Check -in thuận tiện,4
Chỉ cần thêm WiFi miễn phí,2
Chỉ có phong cảnh là đẹp,4
Chiếc giường êm ái,4
chiến thần buffet,3
Chiều vui vẻ,4
Chỉn chu hơn trước,4
Chọn nơi đây quả là đúng đắn,5
"chỗ lưu trú ổn, phong cảnh đẹp",5
chỗ lưu trú ưa thích,5
chỗ nghỉ dưỡng quá tuyệt vời cho gia đình”,5
Chỗ nghỉ dưỡng tuyệt vời,5
"Chỗ nghỉ đẹp, phòng gia đình thoải mái",5
"Chỗ nghỉ tốt, đúng chất Đà Lạt mà giá không quá đắt",5
Chỗ nghỉ tuyệt vời dành cho gia đình,5
Chỗ ở quen thuộc khi lên Đà Lạt,5
Chỗ ở sạch sẽ,5
"Chỗ ở tiện lợi sạch sẽ, không gian thoáng mát, trang trí bắt mắt, cổ kính",5
Chỗ ở tốt,5
"Chỗ ở tốt, bình dân",5
Chỗ ở tuyệt vời và xứng đáng với giá tiền,5
Chỗ ở yên tĩnh để nghỉ ngơi,5
Chốn nghỉ ngơi xanh và sạch,5
Chốn thiên đường,5
Chơi hơi vui nha,5
Chuẩn 5 sao,5
Chuẩn 5 sao ở Nơi tuyệt vời để ở,5
"Chuẩn 5 sao, Nơi tuyệt vời để ở",5
Chuẩn không cần chỉnh.,5
Chúng tôi đã có kỳ nghỉ tuyệt vời.,5
Chúng tôi đã trở lại,5
Chúng tôi ở lại đây trong Tuần trăng mật,5
Chúng tôi rất hài lòng,5
Chúng tôi rất hài lòng và vui vẻ khi ở đây!,5
Chúng tôi sẽ quay trở lại,5
Chút bình yên giữa Sài Gòn náo nhiệt,5
Chút tươi mát giữa cái nóng 36 độ,4
Chuyến công tác đáng nhớ,5
Chuyến công tác và nghỉ dưỡng đẳng cấp,5
Chuyến dài nghỉ dưỡng tại Vinpearl Nha Trang Bay,3
Chuyến du lịch của gia đình,3
Chuyến du lịch cùng đồng nghiệp,3
Chuyên du lịch cùng gia đình,3
Chuyến du lịch cuối năm của cả gia đình,3
Chuyến du lịch đáng nhớ,5
"Chuyến du lịch đầy ắp kỷ niệm, hẹn gặp lại nhé",5
Chuyến du lịch đem lại rất nhiều trải nghiệm thú vị và hạnh phúc,5
Chuyến du lịch thú vị,5
Chuyến du lịch thú vị,5
Chuyến du lịch tuyệt vời cùng gia đình,5
"Chuyến Du Lịch Vui Vẻ, Thoải mái",5
Chuyến du xuân tuyệt vời,5
Chuyến Đến Huế kém mong đợi!,2
Chuyến đi 1 mình,3
Chuyến đi chơi tuyệt vời,5
Chuyến đi công tác,3
Chuyến đi công tác hài lòng,5
Chuyến đi cùng bạn bè,3
Chuyến đi cùng gia đình đáng nhớ!,5
Chuyến đi đáng tiền,5
Chuyến đi đầu năm mới,3
Chuyến đi đầy thú vị.,4
Chuyến đi đầy ý nghĩa,5
Chuyến đi gia đình,3
Chuyến đi giải toả căng thẳng sau bao ngày làm việc mệt mỏi,3
Chuyến đi hoàn hảo,5
Chuyến đi hoàn hảo và tuyệt với với sự phục vụ chuyên nghiệp của Vinpearl Resort & Spa Nha Trang Bay,5
chuyến đi hơn cả tuyệt vời,5
Chuyến đi khá thú vị,5
Chuyến đi mùa covid,3
Chuyến đi này rất là thú vị và vui vẻ .,5
Chuyến đi ngắn ngày tại Huế.,3
Chuyến đi nghỉ của gia đình,3
Chuyến đi nghỉ dưỡng,3
Chuyến đi nghỉ dưỡng an toàn mùa covid,4
Chuyến đi nghỉ dưỡng cùng đoàn rất tuyệt vời,5
Chuyến đi nghỉ dưỡng như mơ,5
Chuyến đi nghỉ dưỡng rất hài lòng,5
Chuyến đi nghỉ dưỡng tuyệt vời,5
Chuyến đi nghỉ rất thú vị,5
Chuyến đi quay lại đáng nhớ,5
Chuyến đi rất thú vị,5
Chuyến đi rất tuyệt,5
Chuyến đi thành công,5
Chuyến đi thú vị từ nghệ an đến huế,5
Chuyến đi tốt đẹp,5
Chuyến đi tốt đẹp và Rất ngọt ngào,5
Chuyến đi trải nghiệm nghỉ thư giãn quá tuyệt vời,5
Chuyến đi trên cả tuyệt vời,5
Chuyến đi tuần trăng mật,3
Chuyến đi tuyệt vời của tôi,5
Chuyến đi tuyệt vời cùng những người bạn,5
Chuyến đi tuyệt vời luôn á,5
Chuyến đi tuyệt vời nhất trong năm,5
Chuyến đi vào những ngày mưa gió,3
chuyến đi với gia đình,3
Chuyến đi với người dân địa phương,3
"Chuyến đi vui vẻ, gần gũi, nhiều cảnh đẹp, rất phù hợp cho nghỉ dưỡng.",5
Chuyến đi ý nghĩa,5
Chuyến nghỉ dưỡng,3
chuyến nghỉ dưỡng cùng gia đình,3
Chuyến nghỉ dưỡng đáng nhớ,5
chuyến nghỉ dưỡng đáng nhớ cùng gia đình ở khách sạn chuẩn 5 sao,5
Chuyến nghỉ dưỡng mùa hè cùng với gia đình,3
Chuyến nghỉ dưỡng tại Vinpearl,3
Chuyến nghỉ dưỡng thú vị,5
Chuyến nghỉ dưỡng vui vẻ,5
Chuyến nghỉ hè thú vị,5
Chuyến nghỉ tuyệt vời,5
Chuyến tham quan đáng nhớ,5
Chuyến tham quan tốt đẹp,5
Chuyến thăm quan nghỉ dưỡng cùng bạn bè tại Vinpearl hạ long,3
Chuyến thăm quan Vinpearl hạ long,3
Chuyến trải nghiệm tuyệt vời.,5
Chuyến trở lại lần 2 tại Sheraton Nha Trang,4
Chưa đáng giá tiền,2
Chưa hài lòng về chất lượng phòng,2
Chương trình tour thành công nhờ một vài cá nhân của vin đã nhiệt tình phục vụ,5
Có một chuyến du lịch tuyệt vời,5
Con người 5 sao - Dịch vụ 5 sao,5
Công tác đáng nhớ,5
Công tác vui vẻ ở nhà hàng Buffet hải sản,5
"Cơ sở vật chất đầy đủ, vẫn là kiểu Vinpearl",4
"cơ sở vật chất tốt, nhân viên bình thường",4
Cung cấp thông tin về trải nghiệm của cá nhân,3
"cũng được, không bằng những lần trước",4
Cùng gia đình nghỉ dưỡng tuyệt vời tại nơi này,5
Cuối tuần cùng cô bạn thân,3
Cuối tuần cùng gia đình tại Sheraton,3
Cuối tuần đáng nhớ,3
Cuối tuần đáng nhớ tại Vinpearl Luxury Landmark 81,4
Cuối tuần tại Sheraton Nha Trang cùng những cô bạn thân,3
Cuối tuần thư giãn tại Sheraton Nha Trang,3
Cuối tuần tuyệt vời,5
"Cực hài lòng,",5
Cực kì hài lòng,5
"Cực xịn sò, rẻ",5
Cứng nhắc trong việc tính thêm giờ phát sinh,2
Dễ chịu,4
"Dễ chịu, đáng giá tiền",4
Dễ thương,4
"Dịch vụ 5 sao, chi phí không cao",5
Dịch vụ chất lượng tốt,5
Dịch vụ chu đáo tận tâm với khách hàng,5
Dịch vụ chuẩn 5 sao,5
Dịch vụ chuyên nghiệp và tận tình,5
Dịch vụ chuyên nghiệp.,5
Dịch vụ đáng tiền,5
Dịch vụ đẳng cấp,5
Dịch vụ đẳng cấp 5 sao,5
Dịch vụ hoàn hảo,5
Dịch vụ hội nghị tốt,5
Dịch vụ khách hàng ra tuyệt vời.,5
Dịch vụ khách hàng rất tốt,5
Dịch vụ khách sạn,4
"Dịch vụ khách sạn rất tốt, nhân viên phòng kinh doanh rất chuyên nghiệp và nhiệt tình .",5
"Dịch vụ khách sạn, nhà hàng rất tuyệt",5
Dịch vụ không tốt,2
Dịch vụ nhà hàng,3
Dịch vụ phòng chưa tốt,2
Dịch vụ phòng họp tuyệt vời.,5
Dịch vụ quá tốt,5
Dịch vụ rất đáng để trải nghiệm,5
Dịch vụ rất đáng tiền,5
Dịch vụ rất tốt,5
Dịch vụ rất tốt - có xe đưa đón tận phòng,5
"Dịch vụ rất tốt, khuyến khích đến đây",5
Dịch vụ rất tuyệt,5
Dịch vụ rất tuyệt vời,5
Dịch vụ resort rất tốt,5
Dịch vụ siêu tốt,5
Dịch vụ spa rất tốt,5
Dịch vụ tại Vinpearl rất tuyệt vời,5
Dịch vụ tạm ổn với giá phòng,4
Dịch vụ tắm bùn thú vị,5
Dịch vụ tận tâm,5
Dịch vụ tận tình,5
"Dịch vụ thân thiện, tuyệt vời",5
Dịch vụ tốt,5
Dịch vụ tốt nhất,5
Dịch vụ tốt và đồ ăn ngon,5
Dịch vụ tốt và nhân viên tuyệt vời,5
"Dịch vụ tốt, chu đáo",5
"Dịch vụ tốt, giá cả hợp lý",5
"Dịch vụ tốt, nhân viên cực kì thân thiện, phòng thoáng cực
 sạch sẽ",5
"Dịch vụ tốt, nhân viên nhân thiện.",5
"Dịch vụ tốt, view biển xuất sắc, nhiều điểm đẹp để chụp ảnh trong resort",5
Dịch vụ tốt; phòng đẹp,5
Dịch vụ trên cả tuyệt vời,5
Dịch vụ trên mong đợi,5
Dịch vụ tuyệt vời,5
Dịch vụ tuyệt vời đẳng cấp 5 Sao.,5
"Dịch vụ tuyệt vời, chuẩn 5 sao",5
"Dịch vụ tuyệt vời, không gian đẹp",5
"Dịch vụ tuyệt vời,, sẽ quay lại lần nữa",5
Dịch vụ và món ăn rất ngon,5
Dịch vụ và phòng rất sạch sẽ,5
Dịch vụ xuất sắc,5
Du lịch nghỉ dưỡng tuyệt vời,5
Du lịch nha trang cùng đồng đội,5
Du lịch nơi đã từng làm việc và đã từng là ngôi nhà thứ 2,5
Du Lịch Thế Giới đánh giá 5 sao cho khách sạn Havana,5
"Duy nhất, khác biệt và đầy thú vị",5
Dừng chân tại Vinpearl Hạ Long thật là 1 lựa chọn đúng đắn,5
Đã đến Vinpearl rất nhiều lần,5
Đã đến Vinpearl rất nhiều lần và luôn hài lòng,5
Đã đi với gia đình,5
Đã lưu trú nhiều lần,5
Đám cưới đáng nhớ,5
đáng để đặt lần tới,5
Đáng Để Đến Một Lần,5
Đáng để ghé lại nhưng sẽ trải nghiệm ở phòng có view ban công,5
Đáng để lưu lại Nha Trang,5
Đáng để thưởng thức,5
Đáng để trải nghiệm,5
Đáng đi,5
Đáng đi tại Đà Lạt,5
Đáng đồng tiền,5
đáng giá điểm khá cho khách sạn,5
Đáng giá là Resort tốt nhất Đà Lạt,5
Đáng giá tiền,5
Đang lên kế hoạch quay lại,5
Đáng nhớ,5
Đáng ở trong tầm giá,5
Đáng quay trở lại,5
"Đáng tiền , phòng ở tiện nghi, nhân viên lịch sự, view đẹp, phòng luôn có mùi tinh dầu sả thơm .",5
"Đáng tiền, gần bãi biển",5
Đáng trải nghiệm nhé,5
đánh giá 1 ngày nghỉ dưỡng tại Vinpearl,5
Đánh giá 5 sao,5
đánh giá ăn buffet tối,3
Đánh giá bể bơi vô cực Sheraton Nha Trang,3
Đánh giá cá nhân,3
Đánh giá cao cách phục vụ của nhà hàng,5
Đánh giá cao chất lượng,5
Đánh giá cao về chất lượng,5
Đánh giá khách sạn 5 sao,5
Đặc biệt,5
Đặc biệt vị trí nằm trong khu Hồ Tuyền Lâm cực kỳ đẹp và lạ,5
Đẳng cấp,5
"Đẳng cấp của một thương hiệu khách sạn 5 sao hàng đầu việt nam , tôi rất thích nơi này mong sớm có ngày trở lại",5
Đẳng cấp là đây,5
"Đăng lại, đẹp, lãng mạn, sang trọng kiểu Pháp",5
Đậm chất nghỉ dưỡng,5
Đầy đủ các tiện ích,5
Đây là 1 nơi nghỉ dưỡng tuyệt vời,5
Đẹp,5
"đẹp , tuyệt vời",5
Đẹp ngoài mong đợi,5
đẹp nhất thành phố,5
Đẹp rụng người,5
Đẹp tuyệt,5
Đẹp và đáng tiền,5
Đẹp và mát mẻ,5
Đẹp và sang trọng,5
Đẹp và thoải mái,5
Đẹp và thơ mộng,5
Đẹp và tiện nghi,5
Đẹp và yên tĩnh,5
Đẹp và yên tĩnh nhưng chất lượng dịch vụ chưa hài lòng.,5
"Đẹp và yên tĩnh, nhất định sẽ quay lại",5
"Đẹp, dịch vụ tốt",5
"Đẹp, nhiều cây xanh, yên tĩnh",5
"Đẹp, rẻ, nhiều tiện ích",5
"Đẹp, sạch sẽ",5
"Đẹp, tiện nghi, sạch sẽ, nhưng hơi xa chợ",5
"Đẹp, xa trung tâm",5
"Đẹp, Xinh",5
"Đẹp, xưa",5
"Đẹp, yên tĩnh, hồ bơi khá nhỏ",4
"Đẹp, yên tĩnh, nhiều hoa",5
"Đẹp, yên tĩnh, tôn trọng trải nghiệm khách hàng, nhân viên tận tình.",5
Đề xuất cao,5
Đêm cùng người yêu,3
Đêm đáng nhớ!,5
Đêm nay rất tuyệt,5
Đêm tuyệt vời,5
Địa chỉ lý tưởng cho nghỉ dưỡng,5
Địa điểm ăn tối ngắm thành phố về đêm,3
Địa điểm cầu hôn,3
Địa điểm đáng để nghỉ ngơi,5
Địa điểm đáng để ở,5
Địa điểm đẹp,5
Địa điểm đẹp nhưng phòng nhỏ,4
Địa điểm gần,4
Địa điểm lý tưởng để ngắm thành phố,5
Địa điểm lý tưởng để nghỉ dưỡng,5
Địa điểm nghỉ dưỡng hợp lý,5
Địa điểm nghỉ dưỡng lý tưởng,5
Địa điểm nghỉ dưỡng tuyệt vời,5
"Địa điểm rất tốt, kiến trúc đẹp",5
Địa điểm tốt,5
Địa điểm tốt để lưu lại khi đến Đà Lạt,5
Địa điểm tốt để nghỉ dưỡng,5
địa điểm tốt để nghỉ dưỡng cuối tuần,5
"Địa điểm tuyệt đẹp, bữa sáng có thể tốt hơn.",4
địa điểm tuyệt vời,5
Địa điểm tuyệt vời cho kỳ nghỉ cùng gia đình,5
Địa điểm tuyệt vời cho tuần trăng mật,5
Địa điểm tuyệt vời đáng giá tiền,5
Địa điểm tuyệt vời để nghỉ dưỡng,5
"Địa điểm tuyệt vời, nhân viên thân thiện và đồ ăn rất ngon.",5
"Địa điểm tuyệt vời, phục vụ chu đáo",5
Điểm 10 cho nghỉ dưỡng,5
Điểm 10 tặng các bạn nhân viên,5
Điểm 9,5
Điểm dừng chân nghỉ ngơi lý tưởng,5
Điểm đến hấp dẫn,5
Điểm đến lý tưởng,5
Điểm đến lý tưởng cho kỳ nghỉ,5
Điểm đến lý tưởng ở Huế,5
"Điểm đến lý tưởng, tuyệt vời",5
Điểm đến rất hài lòng,5
Điểm đến thú vị,5
Điểm đến tuyệt vời,5
Điểm đến tuyệt vời khi ghé thăm Huế,5
Điểm nghỉ dưỡng lý tưởng,5
Điểm nhấn,5
Đỉnh cao của sự phục vụ,5
Đỉnh cao mới của đẳng cấp Việt Nam,5
Đỉnh của chóp,5
"Đón tiếp phục vụ rất tốt, cảm ơn 2 bạn",5
đồ ăn ngon,5
Đồ ăn ngon và dịch vụ chu đáo,5
Đồ ăn ngon và lạ miệng,5
"Đồ ăn ngon, cảnh đẹp",5
"Đồ ăn ngon, dịch vụ tốt",5
"Đồ ăn ngon, không gian đẹp, xem siêu chill.",5
"Đồ ăn ngon, phòng ở sạch sẽ, không gian đẹp",5
"Đồ ăn sáng dở nhưng 1 số món riêng lẻ trong menu lại rất ngon",5
Đồ ăn sáng thứ 2 nghèo nàn.,5
"Đồ đồ ăn ở đây siêu ngon ăn thoải mái vô tư luôn, mê",5
Đồ uống ngon,5
Đội lễ tân rất niềm nở với khách hàng,5
Đội ngũ nhân viên rất nhiệt tình và thân thiện.,5
Đội ngũ nhân viên vô cùng thân thiện và nhiệt tình,5
Đông vui sang trọng,5
Đơn giản và sang trọng,5
Đủ chuẩn 4 sao,5
Đúng chất Đà Lạt,5
Đúng để nghỉ ngơi,5
Được,5
Được đề xuất cao,5
Đường lát đá nên hơi xóc,2
Em không muốn về.,4
Em lễ tân lễ phép và nhiệt tình,5
Gần bến xe,4
"Gần Khu Hòa Bình, phòng mới và sạch sẽ",5
"gần trung tâm , sạch sẽ",5
Ghế bãi biển 8 giờ sáng mới cho ngồi,2
"Giá cả hợp lý, dịch vụ tuyệt vời, chăm sóc khách hàng, thân thiện, thoải mái",5
"Giá cả hợp lý, nhân viên thân thiện và nhiệt tình",5
Giá cả phải chăng,5
giá cả và dịch vụ tốt,5
gia đình chúng tôi khá hài lòng dịch vụ hoàn hảo,5
gia đình có một chuyến đi chơi rất tuyệt vời,5
Gia đình đi du lịch,3
Gia đình đi nghỉ dưỡng,3
Gia đình nghỉ dưỡng phù hợp,3
Gia đình sum họp,5
Gia đình tôi cảm thấy ấn tượng khi được trải nghiệm,5
gia đình tôi có 1 kỳ nghỉ dưỡng vui và thú vị,5
Gia đình tôi đã có 1 kỳ nghỉ tuyệt vời,5
"Gia đình tôi đã có một kỳ nghỉ tuyệt vời, sẽ quay lại đây.",5
Giá mắc so với dịch vụ,2
Giá phù hợp so với các resort khác tại Nha Trang,5
Giá tốt và gần nhất trong các resort ở khu Tuyền Lâm”,5
Giá trị tốt nhất so với số tiền bỏ ra,5
"Giành cho gia đình thích yên tĩnh, nghỉ ngơi",5
giấc ngủ ngon tại wink,5
GIẤC NGỦ TRÊN MÂY,5
Hài lòng,5
Hài lòng dịch vụ khách sạn,5
Hài lòng khi ở đây,5
Hài lòng trên mong đợi,5
Hài lòng tuyệt đối,5
Hài lòng và sẽ quay lại lần sau.,5
Hài lòng về chuyến đi,5
Hài lòng về chuyến đi này,5
Hài lòng về dịch vụ,5
"hài lòng về dịch vụ, tuy nhiên thiếu giới thiệu thông tin, bản đồ của đảo kèm hình ảnh.",4
Hài lòng về tất cả từ dịch vụ đến con người nơi đây,5
Hài lòng vô cùng,5
Hài lòng với chất lượng dịch vụ,5
Hài lòng với chuyến đi vui cùng gia đình,5
Hài lòng với dịch vụ,5
Hài lòng với dịch vụ ở đây.,5
Hài lòng với mọi thứ,5
Hài lòng với số tiền chi trả,5
Hài lòng với trải nghiệm lần này,5
"Hài lòng, rất đáng tiền bỏ ra",5
Hải sản buffet tươi,5
Hạnh phúc khi được ở đây,5
Hạnh phúc nhân đôi,5
HAVANA rất ok,5
HAVANA số 1 Nha Trang,5
Havana số một,5
Havana thật là tuyệt,5
Havana trong lòng tôi,5
Havana tuyệt vời,5
"Havana, tôi thực sự được thư giãn",5
Hãy chọn Amiana cho kỳ nghỉ tuyệt vời của bạn,5
Hãy nghỉ tại khách sạn này,5
Hãy ở theo cách của bạn,3
Hãy tận hưởng những khoảnh khắc này,3
Hấp dẫn cho khách du lịch,5
"Hấp dẫn, năng động",5
Hè thật tuyệt cho gia đình,5
Hẹn lần sau lại đến,5
Hệ thống thiết bị hiện đại,5
Hi vọng được gặp lại nhiều nhiều,5
Hoàn hảo,5
Hoàn hảo Bữa tối,5
"Hoàn hảo cho dịch vụ, và vị trí quá tuyệt vời!",5
Hoàn hảo đúng mức mong đợi,5
Hoàn hảo về mọi mặt,5
Hoàn toàn hài lòng,5
hoàn toàn xứng đáng,5
Hòn đảo tuyệt vời,5
Hòn đảo xanh tươi,3
"Hòn Tằm, một điểm đến không thể bỏ qua",5
Họp mặt cuối năm,3
Họp mặt gia đình cuối năm,3
Hotel đẹp,5
Hotel khá tốt,5
hotel nên ở tại Huế,5
Hotel vô cùng tuyệt vời,5
Hotel với cảnh thiên nhiên tuyệt đẹp và con người thân thiện,5
hồ bơi,3
Hồ bơi đẹp,5
Hồ bơi đẹp tuyệt,5
"Hồ bơi đẹp, Khách sạn sang trọng đúng chuẩn 5 sao",5
Hồ bơi tuyệt vời,5
Hồ bơi và phòng tập thể hình đóng cửa,5
Hồ bơi vô cực và những điều thú vị,5
Hội nghị chuyên nghiệp,5
Hơn cả 5 sao,5
Hơn cả mong đợi,5
Hơn cả sự mong đợi,5
Hơn cả tưởng tượng,5
Hợp cho khách nghỉ dưỡng,5
Hợp lý,5
Hợp với giá tiền,5
Huế đẹp mộng mơ mà con người cũng thân thiện,4
Huế tuyệt vời,4
Hưởng tuần trăng mật,3
"Khá đẹp, tốt có vài điểm cần cải thiện sẽ tốt hơn.",4
Khá hài lòng,4
Khá hài lòng ngoại trừ khu vực tắm trong phòng và thái độ của nhân viên lái xe điện,2
Khá hài lòng trong kỳ nghỉ ở Vinpearl Hạ Long,4
Khá hài lòng tuy nhiên vài điểm cần cải thiện,4
Khá ok,4
Khá ổn,4
Khá ổn cho một chỗ nghỉ ngơi bên gia đình,4
Khá thất vọng,2
Khá thuận tiện cho việc đi lại,4
Khá tốt,4
Khá tuyệt,4
Khá tuyệt vời,4
Khá xa trung tâm,2
Khách du lịch gia đình,3
Khá đẳng cấp,4
Khách hàng sử dụng dịch vụ,3
Khách rất tốt,5
"khách sạn , đồ ăn, nhân viên, cảnh quan đều tuyệt vời",5
Khách sạn 100 điểm,5
Khách sạn 24 giờ,3
khách sạn 3 sao,3
Khách sạn 4 sao,3
Khách sạn 5 sao,5
Khách sạn 5 sao cao cấp,5
Khách sạn 5 sao đẳng cấp ở huế,5
Khách sạn 5 sao HAVANA - một lựa chọn đúng đắn,5
Khách sạn 5 sao Quốc Tế tuyệt vời,5
Khách sạn 5 sao tại Nha Trang,5
Khách sạn 5 sao tuyệt vời,5
"Khách sạn 5 sao với dịch vụ tốt, đồ uống ngon",5
khách sạn trang trí xinh,5
"Khách sạn ấm cúng, cảm giác như ở nhà",5
Khách sạn bên đảo hòn tre,3
Khách sạn cần cải thiện cơ sở vật chất,2
Khách sạn cần hoàn thiện các hạng mục,2
Khách sạn chăm sóc khách hàng lớn tuổi tốt,5
Khách sạn chất lượng,5
Khách sạn chất lượng rất tốt,5
Khách sạn chất lượng tuyệt vời,5
"Khách sạn chất lượng, nhân viên nhiệt tình vui vẻ",5
Khách sạn chuẩn 5 sao cùng gia đình,5
khách sạn chuẩn hiện đại,5
Khách sạn chuyên nghiệp,5
Khách sạn có bãi đậu xe siêu thuận tiện,5
Khách sạn có cảnh quang gần như đẹp nhất đà lạt!,5
Khách sạn có chất lượng vừa đủ,5
Khách sạn có hai cơ sở thật thuận tiện.,5
Khách Sạn có hệ thống An Ninh Tốt,5
Khách sạn có hệ thống check-in tự động,5
Khách sạn có hồ bơi,5
khách sạn có hồ bơi đẹp,5
Khách sạn có hồ bơi tuyệt vời,5
"Khách sạn có không gian dễ chịu,tiện nghi,đẳng cấp, phòng nghỉ tuyệt vời.",5
"Khách sạn có phong cách cổ điển, yên tĩnh, bình yên",5
Khách sạn có thiết kế độc đáo và chất lượng dịch vụ tốt,5
Khách sạn có vị trí đẹp,5
Khách sạn có vị trí thuận tiện,5
Khách sạn có view đẹp,5
Khách sạn Có view đẹp đáng để trải nghiệm tại Sài Gòn,5
Khách sạn có view đẹp nhất Thành phố Hồ chí Minh,5
Khách sạn có View rất đẹp,5
Khách sạn có view siêu đẹp,5
Khách sạn có view tuyệt đẹp,5
Khách sạn cổ kính,5
khách sạn cổ kính và lãng mạn,5
Khách sạn của sự hài lòng,5
Khách sạn dễ thương,5
Khách sạn dễ thương nhất quả đất,5
Khách sạn dịch vụ tốt,5
Khách sạn đã hoàn tiền,3
Khách sạn đáng để đi ở Huế,5
Khách sạn đáng để ở,5
Khách sạn đáng để trải nghiệm,5
Khách sạn đáng đến nhận phòng,5
khách sạn đáng giá,5
Khách sạn đáng ở khi tới thành phố biển Nha Trang,5
"Khách sạn đáng tiền,bãi biển yên tĩnh",5
"Khách sạn đáng yêu , phục vụ rất tốt",5
Khách sạn đáng yêu và thân thiện,5
Khách sạn đáng yêu với thái độ phục vụ niềm nở,5
