Text,Label
Ăn sáng không ngon,1
Ban giám đốc khu nghỉ xem lại cách tính giá cả dịch vụ và thu phụ phí thái độ nhân viên khi khách check out thì coi không ra gì,1
bộ phận sales kém,1
Bố trí trong phòng không hợp lý,1
Cách âm kém,1
Cần cải thiện,4
Cần cải thiện 1 chút để tuyệt vời hơn,4
Cần cải thiện bữa ăn sáng,4
Cần cải thiện chất lượng buffet sáng,4
Cần cải tiến để đủ chuẩn 5 sao,4
Cần cân nhắc,2
Cần cẩn trọng trong việc sắp phòng,2
"Cân nhắc giá cao và mức phí phụ thu, ăn sáng không phong phú và mau hết đồ ăn",2
chán,1
Chắc là sẽ không quay lại,1
"Chăn ga gối nệm bẩn, giường, lò xo, võng không thoải mái",1
chất lượng 2 sao,1
chất lượng dịch vụ quá tệ,1
chất lượng kém,1
chất lượng không tương xứng,1
Chất lượng nhân viên kém,1
Chi phí phòng và dịch vụ không ổn.,1
Chiếc bánh kem bị hỏng,2
cơ sở vật chất phòng ốc 5 sao nhưng cái tâm khi làm dịch vụ chưa cao,4
cực kì tệ,1
dịch vụ kém,1
Dịch vụ kém,1
dịch vụ khách sạn quá kém,1
Dịch Vụ không tương xứng,1
Dịch vụ không xứng đồng tiền,1
dịch vụ quá tệ,1
Dịch vụ tệ,1
dịch vụ tồi tệ và khủng khiếp,1
"Dọn phòng không kỹ, xử lý vấn đề chậm.",1
dối trá và coi thường khách hàng,1
đáng ra với tiếng tăm như vậy thì nên làm tốt hơn,1
Đánh giá không được 5 sao,2
đặt phòng view biển nhưng phòng view công trình đang xây dựng,2
Đi nghỉ dưỡng nhưng vác thêm bực bội vào trong mình,1
đón sinh nhật tại amiana quá tệ,1
Đông khách Trung Quốc quá,2
Giá đắt so với chất lượng,1
Giá đắt so với dịch vụ,1
"Giá hơi mắc so với tiện nghi khách sạn, cách âm kém",1
Hệ thống nước nóng hoạt động không tốt,2
Hơi mất vui,2
Hơi thất vọng,2
kém,1
khá tệ,1
khách sạn 5 sao nhưng hành xử rất lạ hoàn toàn thất vọng,2
Khách sạn âm u và cũ kỹ,1
Khách sạn chất lượng kém,1
Khách sạn có nhiều vấn đề như thế này đấy.,2
khách sạn có view đẹp nhưng dịch vụ không tốt,2
"Khách sạn cũ, nhân viên phục vụ kém",1
Khách sạn không tương xứng với đáng giá 4 sao,1
khách sạn quá tệ,1
Khách sạn quá tệ so với giá tiền,1
khách sạn rất tệ,1
khách sạn tuyệt vời có 1 nhân viên phục vụ tồi,1
không chuyên nghiệp,1
Không còn tốt như xưa,2
"Không đáng giá tiền, thiếu các tiện nghi trong phòng và không giống hình ảnh cung cấp",1
không được thoải mái,1
không được tốt,1
Không hài lòng,1
Không hài lòng,1
"Không hài lòng lắm vì hình ảnh trên đặt trước không giống thực tế phòng tôi đã ở, tên gọi cũng khác.",1
Không hài lòng về lễ tân,1
Không hẳn như mong đợi,2
Không mấy vui vẻ,1
Không nên ở,1
Không như mong đợi,1
Không phải lúc nào ở khách sạn 5 sao thì cũng có trải nghiệm tốt nhất,1
không thật sự tốt,1
Không thích nơi này,1
Không thoải mái lắm,1
không tin vào mắt mình đây là khách sạn năm sao,1
không trung thực dịch vụ chăm sóc khách hàng tồi tệ,1
Không truy cập được vào Wifi.,1
không uy tín,1
Không xứng với danh hiệu 5 sao,1
"không xứng với giá tiền, thức ăn sáng quá dở",1
"khung cảnh còn ổn, đồ ăn sáng nghèo nàn, quản lý và nhân viên quá tệ khách không được tôn trọng",1
Khủng khiếp,1
kinh khủng tồi tệ,1
kinh tởm về dịch vụ,1
Kỳ nghỉ hơi khó chịu,1
lễ tân không chuyên nghiệp,1
lễ tân thiếu thân thiện phòng ốc bình thường giá chát khách sạn 4 sao nước hồ bơi lạnh như quỷ,1
Mất đồ khi dọn phòng,1
mất niềm tin vào vinpearl hotel,1
mất tiền tại vinpearl nha trang resort bay,1
Mất tiền trông xe qua đêm,1
mình đã bị nhận phòng phòng chưa dọn với toilet chưa dội và dơ,1
mọi thứ đều ổn trừ khách sạn,1
món ăn rất tệ,1
một đi không trở lại,1
"Nhân viên ít có nụ cười, dép không vệ sinh.",1
"Nhân viên không tốt lắm, dịch vụ hơi khó khăn.",1
nhân viên không tốt và tiện nghi không đủ,1
nhân viên không trung thực,1
"Nhân viên lễ tân hơi chảnh, hồ bơi không có người trực và không được sạch sẽ",1
Nhân viên lễ tân mặt luôn kên kên,1
"Nhân viên mất lịch sự, khinh thường khách",1
"Nhân viên nghiệp vụ còn rất kém, khi đặt trên Agoda cảm
giác khó chịu ra mặt.",1
Nhân viên phục vụ tồi tệ,1
Nhân viên rất đáng thất vọng,1
nhân viên xem thường khách hàng,1
những trải nghiệm quá đáng sợ,1
"nói chung Đà Lạt có nhiều sự lựa chọn về chỗ nghỉ, nên chắc chắn là không quay lại nữa",1
"Nói chung là ổn định trong tầm giá, còn dịch vụ đạt 4 sao thì chưa",2
ồn ào,1
"Ồn ào vì phòng cách âm quá kém, các phòng bên cạnh gây ồn ào ban đêm không thể ngủ được, quạt thông gió nhà vệ sinh là quạt trung tâm và ngưng hoạt động vào buổi tối gây bất tiện khi dùng vì không tự mở được",1
"Phòng áp mái nhỏ, bị cụng đầu",1
phòng bẩn nhân viên thờ ơ,1
Phòng bị mốc,1
Phòng cách âm không tốt lắm,2
Phòng cách âm rất kém,1
"Phòng cách âm tệ, nhân viên lười biếng không hiếu khách",1
Phòng cũ,1
"Phòng cũ, cách âm kém và nhiều muỗi",1
Phòng hơi bí,2
Phòng khách sạn nhỏ,1
Phòng không cách âm ,1
"Phòng không cách âm, các phòng khác nói chuyện hay làm gì đều nghe được hết.",1
Phòng không cảm giác riêng tư,1
"phòng không có view như trên hình ảnh, mở cửa là vách tường, nhân viên phục vụ bình thường, phòng sạch sẽ, mở cửa 24 giờ cho khách",2
phòng không đẹp không có điều hòa,1
"Phòng không như hình, cây to chắn mất view",1
"Phòng không như hình,nhân viên khó chịu, tiếp tân không tốt, ăn sáng tệ",1
phòng không tốt,1
Phòng ốc bố trí không hợp lý,1
Phòng ở dơ bẩn không tiện nghi,1
phòng tầng hầm ẩm thấp ồn ào,1
phòng tiêu chuẩn tầng hầm cực tệ nội thất thua nhà nghỉ bình dân,1
Phụ phí giặt ủi không hợp lý,1
Phục vụ chưa tốt,2
Nhân viên không nhiệt tình lắm,1
Phục vụ tệ,1
quá chán,1
Quá tải và cần chuyên nghiệp hơn,1
quá tệ,1
quá tệ cho 1 khách sạn 5 sao,1
quá tệ không quay lại,1
quá tệ phòng ổn nhưng máy bơm ngay trên đầu ổn alo nhân viên không giải quyết và không nghe điện thoại,1
quá tệ thuê villa mà không cho sử dụng dịch vụ,1
quá tệ tôi và vợ không cảm thấy thoải mái,1
rất không hài lòng,1
rất ồn,1
rất tệ,1
rất thất vọng về khách sạn này,1
Resort chất lượng quá kém,1
"Resort rất cũ, chỉ tương đương 4 sao, mình sẽ không trở lại hay giới thiệu cho người thân và bạn bè.",1
"Sau thời gian dài, tình hình nhân viên điển hình là
Tiếp tân và Phục Vụ vẫn không khá lên nổi.",1
Sẽ không quay trở lại,1
sự thất vọng cực lớn,1
Tệ,1
thái độ coi thường khách hàng,1
Thái độ nhân viên chưa tốt,1
thái độ nhân viên phục vụ không ra gì,1
thái độ phục vụ của nv lễ tân không chấp nhận được phòng ốc không đủ tiêu chuẩn 4,1
thật kinh khủng và không thể chấp nhận,1
thật kinh khủng và không thể chấp nhận được lần thứ 2 ghé vinpearl đã hy vọng sẽ k có chuyện không vui như đợt trước nhưng vẫn như vậy k thay đổi,1
Thất vọng,1
Thất vọng về Sheraton,1
Thất vọng với nhân viên lễ tân,1
thủ tục nhận phòng rập khuôn thiếu linh động và cực kỳ tốn thời gian,1
thức ăn tại resort tệ không phong phú,1
Tín hiệu tivi yếu,1
tôi bị mất ngủ và giờ về tới sài gòn vẫn bị ám ảnh bởi tiếng rên la ấy,1
tôi cảm thấy bị xúc phạm khi cùng gia đình trải nghiệm dịch vụ tại đây,1
trải nghiệm chưa thật sự tốt ở đây,1
trải nghiệm cực kỳ tồi tệ x 1000 lần,1
trải nghiệm không như mong đợi,1
Trải nghiệm không tốt,1
trải nghiệm tệ tại park lounge sài gòn nhân viên thái độ,1
vận hành dịch vụ tệ,1
villa không như mong đợi,1
Vô cùng thất vọng,1
xếp phòng cẩu thả,1
"Bình thường, khá xa trung tâm, đường đèo dốc nguy hiểm,
 phòng tầng hầm bí view, nóng, ồn, đắt và khó ở dài ngày.",1
Chất lượng dịch vụ không tương xứng,1
Chất lượng dịch vụ và cơ sở vật chất chấp nhận được.,1
Chất lượng giảm dần theo năm tháng,1
Chỉ có phong cảnh là đẹp,1
Chưa hài lòng,1
Chưa thực sự hài lòng,1
Chưa tương xứng với 5 sao,1
Chưa xứng đáng 5 sao,1
Có thể chấp nhận được,1
Cơ sở bị hư,1
Bữa sáng tệ,1
"Cảnh đẹp, thất vọng với thiết kế",2
Cảnh quan đẹp nhưng dịch vụ không tốt,2
Cần cải thiện nhiều hơn,1
Cần cải thiện wifi và sóng điện thoại,1
"Dịch vụ xe đưa đón trong resort chờ quá lâu,lễ tân làm thủ tục chưa thực sự thân thiện, wifi chán",1
"Đi quá nhiều không thấy thay đổi, không còn hứng thú.",1
"Địa điểm tốt, cảnh đẹp nhưng thủ tục trả phòng tệ",2
Địa điểm tuyệt vời nhưng chất lượng phục vụ kém,2
Đường đi đến khách sạn rất khó tìm,1
"Địa điểm tốt, cảnh đẹp nhưng Check out tệ",2
Khách sạn có nhiều vấn đề như thế này đấy.,1
"Khách sạn có view đẹp nhưng còn nhiều hạn chế, mong chủ khách sạn đọc được để cải thiện.",1
Khách sạn dễ thương nhưng sàn gỗ kêu quá,2
Khách sạn đẹp dịch vụ tốt nhưng hơi buồn,2
Khách sạn đẹp nhưng phục vụ chưa tốt,2
"Khách sạn đẹp, gần trung tâm nhưng đồ ăn sáng hơi ít",2
Khách sạn tạm ổn nhưng cũ,2
"Khách sạn tương đối,nhưng đồ ăn nhà hàng chưa ngon, nhân viên vui vẻ",2
"không còn ấn tượng như vài lần trước đây , cả gia đình mình từng ở Terracotta này.",1
"Không đa dạng, nếu được đi lại sẽ đi buổi tối.",1
Không đề xuất,1
Không gian đẹp nhưng thái độ nhân viên ở quầy lễ tân hơi tệ,2
Mắc nhưng đáng tiền,4
Mọi thứ đều ổn trừ hồ bơi,2
Mọi thứ đều tuyệt vời ngoại trừ vấn đề cách âm phòng ngủ.,2
Mọi thứ Ok trừ bãi đỗ xe cho khách,2
Một kì nghỉ khá ổn.,4
Một trải nghiệm mới vui vẻ nhưng chưa thật xuất sắc như mình mong đợi.,4
Nên suy nghĩ khi đặt phòng tại đây,1
Phí phụ thu không hề được thông báo trước,1
"Phong cảnh đẹp, yên tĩnh, nhà hàng không ngon lắm, xe điện đợi lâu",2
Phòng chất lượng trung bình,2
Phòng hiện đại nhưng dịch vụ chưa tốt,2
"Phòng sạch, dọn kĩ lưỡng nhưng dịch vụ và ăn uống không đặc sắc",2
"Phòng view ổn, nhiều khách Trung Quốc, hơi ồn ào , bể bơi không đẹp, vị trí tốt, nhân viên lễ tân cũng bình thường, chưa nhiệt tình lắm",2
Quá Tuyệt nhưng không có wifi,2
Resort đẹp nhưng chất lượng chưa xứng 5 sao,4
Resort rất đẹp nhưng không gây được thiện cảm,2
"Tạm được, không ấn tượng gì",2
"Tạm được, tuy nhiên âm nhạc quá lớn tới khuya gây ảnh hưởng nghỉ ngơi.",2
Tất cả đều rất tuyệt nhưng thiếu tiện nghi,2
"thoải mái , nhưng hồ bơi bị nghỉ quá buồn",2
Trải nghiệm khách sạn đẳng cấp nhưng phục vụ chưa tới tầm,2
"View đẹp, sạch sẽ nhưng nhân viên không tốt.",2
Vừa thích vừa chưa ưng,2
Tiện nghi ổn nhưng giá hơi đắt,2
đi nghỉ nhưng không nghỉ được,2
"Buffet trưa, tạm ổn, 6/10. Tráng miệng ngon, món mặn quá ít.",2
Bungalow đẹp nhưng không có sự riêng tư,2
Ăn sáng cùng với gia đình,3
Ăn sáng tầng 19,3
Ăn tại nhà hàng lần đầu,3
Ăn tối cùng gia đình,3
Ăn trưa buffet,3
Ăn trưa cùng đồng nghiệp,3
Ăn trưa cùng gia đình,3
Ăn trưa ngày cuối tuần cùng gia đình,3
ăn trưa tại nhà hàng,3
Ăn trưa với các anh chị em đồng nghiệp,3
Ăn uống cùng công ty,3
Ăn uống khám phá,3
Ăn uống vào ngày bình thường,3
Bạn bè nghỉ dưỡng,3
Bể bơi lúc hoàng hôn,3
bình thường,3
Bình thường,3
Bốn bể là nhà,3
Buffet cuối tuần,3
Buffet hải sản,3
"Buffet hải sản tầng 1, hồ bơi, sảnh",3
Buffet sáng,3
Buffet tối với bạn bè,3
Buffet tối với cả nhà,3
Buffet trưa cùng gia đình,3
Buổi dùng bữa gặp mặt cùng bạn tôi,3
Buổi họp mặt cuối năm thuận lợi,3
Buổi họp mặt gia đình,3
Buổi họp mặt tại buffet hải sản,3
Buổi sinh nhật đáng nhớ,3
Buổi sinh nhật vui vẻ,3
Buổi tiệc rất ấn tượng,5
Buổi tối ấm cúng buffet hải sản,3
Buổi tối buffet ngoài trời,3
Buổi tối cùng bạn bè và gia đình,3
Buổi tối cùng gia đình,3
Buổi tối đáng nhớ tại buffet hải sản,3
Buổi tối đáng tiền,4
buổi tối lãng mạn,4
Buổi tối lãng mạn cùng người yêu,3
Buổi tối với khách sạn,3
Buổi tối vui vẻ cùng con trai,3
Buổi tối vui vẻ cùng gia đình,3
Buổi trưa cùng bạn bè,3
Buổi trưa cùng gia đình,3
Buổi trưa cùng với bạn,3
Buổi trưa vui vẻ bên gia đình tại lavela,3
Buổi trưa vui vẻ tại La Vela,4
Buổi trưa vui vẻ tại nhà hàng mermaid lavela,4
Bữa ăn ấm cúng cùng gia đình tại lavela,4
Bữa ăn ấm cúng vui vẻ cùng gia đình,3
Bữa ăn cuối tuần,3
Bữa ăn gia đình,3
Bữa ăn gia đình tại khách sạn,3
Bữa gặp mặt bạn bè,3
Bữa họp mặt ý nghĩa,3
Bữa sáng cuối tuần,3
Bữa tối buffet,3
Bữa tối cùng gia đình,3
Bữa tối cùng mọi người ở Mermaid,3
Bữa tối cuối năm,3
Bữa tối cuối tuần,3
Bữa tối cuối tuần với gia đình,3
Bữa tối đầu tuần,3
Bữa tối hải sản nhà hàng nàng tiên cá,3
Bữa tối sang trọng phù hợp mời đối tác,3
Bữa tối tại khách sạn 5 sao,3
"Bữa tối thú vị, lãng mạn",3
Bữa tối với chồng yêu,3
Bữa tối với gia đình,3
Bữa tối vui vẻ,3
Bữa trưa cùng gia đình tôi,3
Bữa trưa cùng hội chị em thân ai nấy lo,3
Bữa trưa cuối tuần gặp mặt bạn bè,3
Bữa trưa nhân dịp đặc biệt,3
Bữa trưa tự chọn cùng gia đình tôi,3
Cách âm phòng tạm ổn,3
cảm nghĩ về vinpearl,3
Cảm nhận chuyến đi 3 ngày 2 đêm ở resort Amiana,3
Cảm nhận của chúng tôi về bạn,3
Cảm nhận của khách hàng,3
Cảm nhận đầu năm,3
Cảm nhận đồ ăn,3
Cảm nhận khi nghỉ dưỡng tại Havana,3
Cảm nhận khi ở Vinpearl Nha Trang Bay,3
Cảm nhận sự yên bình,3
Cảm nhận tại nhà hàng La Vela Sài gòn.,3
Cảm nhận về khách sạn,3
Cảm nhận về nhà hàng và spa khu nghỉ dưỡng Vinpearl Hạ Long,3
Cảm xúc của tôi về Amiana!,3
Dịch vụ khách sạn,3
Dùng Cocktail trên tầng thượng,3
Đánh giá chất lượng,3
Đánh giá chất lượng dịch vụ,3
đánh giá chất lượng khách sạn,3
"Đánh giá chất lượng phục vụ, chăm sóc khách hàng",3
Đánh giá chất lượng Vinpearl,3
Đánh giá cho lần trải nghiệm dịch vụ tại khách sạn,3
Đánh giá chung khu nghỉ dưỡng,3
Đánh giá chung về khách sạn,3
Đánh giá dịch vụ,3
Đánh giá dịch vụ khách sạn,3
đánh giá dịch vụ spa,3
Đánh giá đồ ăn tại nhà hàng,3
đánh giá khách sạn havana,3
"đánh giá khách sạn vinpearl hạ long , phòng ốc , dịch vụ chăm sóc khách hàng , phòng gym, bể bơi , pool bar vân vân vân vân",3
Đánh giá kỳ du lịch,3
Đánh giá kỳ nghỉ Vinpearland Nha Trang,3
Đánh giá Mermaid ngày đi ăn cùng đối tác,3
đánh giá một chút về Vinpearl Nha Trang Bay,3
Đánh giá mức độ hài lòng,3
Đánh giá mức độ phục vụ,3
Đánh giá nhân viên,3
Đánh giá phản hồi,3
Đánh giá phòng và dịch vụ tiện ích của khách sạn,3
Đánh giá phục vụ,3
đánh giá sau khi ở,3
Đánh giá sự hài lòng,3
đánh giá thức ăn,3
Đánh giá tiệc Buffet trưa,3
Đánh giá tốt,3
Đánh giá trải nghiệm,3
Đánh giá trải nghiệm của khách sạn,3
Đánh giá trải nghiệm du lịch ở resort,3
"Đánh giá trải nghiệm lặn ngắm san hô, ngắm cá, team building",3
Đánh giá tuyệt vời,5
Đánh giá về bữa ăn,3
Đánh giá về chất lượng dịch vụ,3
Đánh giá về khách sạn Landmark 81,3
Đánh giá về trải nghiệm tại khách sạn,3
Đắt nhưng chất lượng.,4
Đầu tuần có nhiều niềm vui,3
Đầu tuần vui vẻ tại khách sạn,3
Đẹp và yên tĩnh nhưng chất lượng dịch vụ chưa tốt,2
Đi 1 lần cho biết.,3
Đi ăn cùng các bạn già và gia đình,3
Đi ăn cùng con trai,3
Đi ăn cùng gia đình,3
Đi ăn cùng vợ,3
Đi ăn cùng với anh em,3
Đi ăn tối ở La Vela Hotel,3
Đi ăn tối với gia đình,3
Đi ăn với bạn,3
Đi ăn với gia đình,3
Đi cafe cùng người bạn của tui tại khách sạn,3
Đi chơi,3
Đi chơi kết hợp nghỉ dưỡng,3
Đi chơi với bạn bè của tôi,3
Đi công tác,3
Đi du lịch cùng bạn bè.,3
Đi du lịch cùng công ty,3
Đi du lịch ngắm cảnh nghỉ dưỡng,3
Đi du lịch với người yêu,3
Đi dự hội nghị tại Vinpearl,3
Đi họp,3
Đi nghỉ dưỡng,3
Đi nghỉ dưỡng cùng gia đình,3
Đi tham quan,3
Đi thư giãn,3
Đi trải nghiệm,3
Đi uống cà phê ngắm cảnh,3
"Đọc đánh giá ở Agoda, nhưng rất hụt hẫng.",2
Góc đánh giá Vinpearl Hạ Long,3
Hẹn hò cùng bạn bè,3
Hẹn hò dành cho cặp đôi,3
Hẹn hò trưa,3
Hẹn hò với bạn trai của tôi,3
Hồ bơi và trà chiều,3
Hội ngộ nhóm bạn thân,3
Hội tụ bạn bè,3
"Huế bình yên ,thân thiện",3
Khách sạn cho du khách Trung Quốc hay gì á,2
Khách sạn gần gũi với thiên nhiên,3
Kì nghỉ 3 ngày 2 đêm,3
Kì nghỉ tết dương lịch,3
Kỳ nghỉ 3 đêm với gia đình,3
Kỳ nghỉ 4 ngày 3 đêm tại Villa 2 phòng ngủ,3
Kỳ nghỉ 8/3,3
Kỳ nghỉ ấm áp,3
Kỳ nghỉ ấn tượng,3
Kỳ nghỉ cặp đôi,3
Kỳ nghỉ cho con trai tại Vinpearl,3
Kỳ nghỉ của chúng tôi,3
Kỳ nghỉ của gia đình,3
Kỳ nghỉ cùng bạn bè,3
kỳ nghỉ cùng công ty,3
Kỳ nghỉ cùng công ty với nhiều trải nghiệm,3
Kỳ nghỉ cùng gia đình,3
Kỳ nghỉ cùng gia đình lúc mùa xuân,3
Kỳ nghỉ cùng gia đình tại Vinpearl Hạ long,3
Kỳ nghỉ cùng với tình yêu,3
Kỳ nghỉ cuối tuần,3
Kỳ nghỉ dịch thú vị,3
Kỳ nghỉ dưỡng,3
Kỳ nghỉ dưỡng cùng gia đình,3
kỳ nghỉ đáng lý là 7 đêm nhưng rút ngắn 3 đêm,3
Mưa và suối chảy róc rách,3
nghỉ dưỡng,3
nghỉ dưỡng cặp đôi,3
Nghỉ dưỡng cùng bạn bè,3
Nghỉ dưỡng cùng công ty,3
Nghỉ dưỡng cùng gia đình,3
Nghỉ dưỡng cùng gia đình nhỏ,3
Nghỉ dưỡng cùng gia đình và người thân,3
Nghỉ dưỡng cùng gia đình vui vẻ,3
Nghỉ dưỡng cùng người thân,3
Nghỉ dưỡng cuối hè,3
Nghỉ dưỡng cuối tuần,3
Nghỉ dưỡng gia đình,3
Nghỉ dưỡng mùa hè,3
nghỉ dưỡng ở khu resort 5 sao,3
Nghỉ dưỡng ở Vinpearl,3
Nghỉ dưỡng phù hợp,3
Nghỉ dưỡng rất vui ở vinpearl,3
Nghỉ dưỡng tại Vinwonder cùng người thân,3
Nghỉ dưỡng team building,3
nghỉ dưỡng và vui chơi,3
Nghỉ dưỡng vinpearl,3
Nghỉ dưỡng với bạn bè,3
Nghỉ dưỡng với gia đình,3
Nghỉ hè cùng gia đình,3
Nghỉ hè muộn của bọn trẻ con,3
Nghỉ lễ cùng gia đình tại Vinpearl,3
Nghỉ lễ vui vẻ,3
Nghỉ ngắn hạn dịp sinh nhật người thân gia đình,3
nhớ kiểm tra nước bánh khi nhận phòng,3
Phòng tiêu chuẩn 3 sao,3
Tiệc năm mới,3
Tiệc sinh nhật,3
Tiệc sinh nhật cùng bạn bè,3
Trải nghiệm bình thường,3
Trải nghiệm cùng bạn bè,3
Trải nghiệm cùng hội chị em xinh đẹp,3
Trải nghiệm cuối tuần,3
Trải nghiệm dịch vụ,3
Trải nghiệm về kỳ nghỉ dưỡng tại Amiana,3
Trung bình,3
Vệ sinh,3
Vệ sinh resort,3
Tạm ổn,4
Tàm tạm,4
tạm được,4
1 chuyến đi tuyệt vời,5
1 chuyến nghỉ dưỡng xứng đáng,5
1 chuyến trải nghiệm tuyệt vời cùng gia đình tại Vinpearl Nha Trang Bay,5
1 khu resort đẹp và yên tĩnh,5
1 kỳ nghỉ đáng nhớ,5
1 kỳ nghỉ thú vị,5
1 kỳ nghỉ tuyệt vời,5
1 nơi lý tưởng cho chuyến du lịch dành cho 2 người,5
1 nơi tuyệt vời để nghỉ ngơi,5
1 sự trải nghiệm tuyệt vời,5
1 trải nghiệm trên cả tuyệt vời,5
10 điểm,5
10 điểm chất lượng,5
10 điểm cho chất lượng và dịch vụ.,5
10 điểm cho sự hoàn hảo,5
10 điểm không có nhưng,5
10/10 sẽ quay lại,5
2 ngày 1 đêm ổn,5
"2 ngày 1 đêm, chuyến đi một mình, tận hưởng trọn vẹn nhất",5
2 người đi thư giãn,5
2 trong Top khách sạn 3 sao nên ở nhất tại Đà Nẵng - hãy phát huy,5
3 ngày 2 đêm cho chuyến đi Tuần trăng mật tuyệt vời,5
"3 ngày 2 đêm giá hơn 10 triệu cho 2 vợ chồng với 2 em bé,ăn uống,đi chơi mọi dịch vụ miễn phí",5
5 sao,5
5 sao cho dịch vụ tại vinpearl,5
5 sao mà chưa 5 sao,5
5 sao nha,5
"6 đêm ở Terracotta, chỉ địa điểm và đồ ăn là mình thấy hợp lý.",5
6 sao và hơn thế nữa,5
999 like cho Navada,5
Amiana - Một trải nghiệm tuyệt vời,5
"Amiana đáng yêu, thân thiện",5
AMIANA Nơi nghỉ dưỡng tuyệt vời,5
Amiana Resort Nha Trang - một địa điểm rất đáng để quay lại.,5
Amiana resort Nha Trang là một resort đẹp và chất lượng.,5
"Amiana Resort Nha Trang, điểm đến tuyệt vời",5
"Amiana tuyệt vời,gia đình mình sẽ quay lại.",5
Amiana- Điểm 10 cho chất lượng,5
Ăn một bữa tối tuyệt vời tại nhà hàng,5
Ăn sáng ngon,5
"ăn sáng ngon, nhân viên dễ thương, nhiệt tình",5
"Ăn sáng ngon, nhân viên nhiệt tình.",5
"Ăn tại nhà hàng mermaid buổi sáng ngày 16/11, nhân viên rất nhiệt tình vui vẻ, niềm nở, tôi rất vui khi hàng",5
"Ăn trưa tại nhà hàng mermaid khách sạn La vela , phục vụ rất nhiệt tình vui vẻ",5
"Ấm áp, tiện nghi",5
Ấn tượng,5
Ấn tượng khó phai,5
Ấn tượng Mường Thanh,4
Ấn tượng nhân viên,4
Ấn tượng tốt,5
Ấn tượng về không gian khu resort,4
Ấn tượng với mọi thứ trong khách sạn,4
Bãi biển cực đẹp trước khách sạn,4
Bãi biển riêng không đẹp lắm nhưng mọi thứ đều ổn,4
Bãi biển riêng rất đẹp,5
Bãi biển thật đẹp,5
Bãi biển tuyệt đẹp,5
Bạn lễ tân nhiệt tình,5
Bạn sẽ không hối tiếc khi chọn nơi này,5
"bất ngờ ,nhân viên nhiệt tình,thân thiện,thức ăn ngon view đẹp ngắm toàn thành phố",5
Bể bơi nước ấm mùa đông,5
Bể bơi tốt,5
"Biển đẹp, Thức ăn ngon, Thái độ phục vụ tốt.",5
"Biển và hồ bơi rất đẹp, dịch vụ tắm bùn thú vị",5
Biệt thự cổ trên đồi thông lãng mạn,5
Biệt thự dễ thương,5
Biệt thự nhẹ nhàng yên tĩnh đầy hoa,5
Biệt thự sát biển thật đẹp,5
Bình yên,4
Bình yên chim hót,4
Bình yên giữa trung tâm thành phố,5
Bộ phận lễ tân làm thủ tục và hỗ trợ nhanh chóng,5
Bố trí đẹp và phòng tiện nghi,5
Buffet dimsum tuyệt vời cùng gia đình,5
Buffet đa dạng món,5
Buffet đầy ý nghĩa,5
Buffet Hải sản ngon miệng,5
Buffet hải sản và hơn thế nữa,5
Buffet ngon hải sản tươi,5
buffet tối ngon miệng,5
Buffet tối tuyệt vời,5
Bungalow đẹp đã cứu tất cả những nhược điểm,4
Bungalow gia đình tuyệt vời,5
"Bungalow sạch sẽ, rộng, view vườn rất đẹp",5
Buổi ăn tối cuối tuần tuyệt vời ở nhà hàng buffet hải sản,5
Buổi tối thú vị,5
Buổi tối tuyệt vời,5
"Buổi tối tuyệt vời, vui vẻ và chất lượng",5
buổi trưa đáng giá,5
Buổi trưa ngon miệng,5
buổi trưa tuyệt vời,5
bữa ăn ngon,5
Bữa ăn ngon và chất lượng,5
Bữa ăn sinh nhật cùng gia đình,5
Bữa ăn tuyệt vời tại nhà hàng,5
Bữa sáng ngon miệng,5
Bữa sáng trong mơ,5
Bữa sáng tuyệt vời,5
Bữa sáng tuyệt vời tại Sheraton,5
Bữa Sinh Nhật đáng nhớ dành cho Mẹ của tôi,5
