Text,Label
Một địa điểm tuyệt vời cho gia đình,5
một địa điểm tuyệt vời cho kỳ nghỉ lãng mạn,5
Một địa điểm tuyệt vời để nghỉ dưỡng,5
Một địa điểm tuyệt vời tại miền Bắc cho nghỉ dưỡng.,5
Một điểm dừng chân thú vị ở Huế,5
Một khách sạn 5 sao tuyệt đẹp!,5
Một khách sạn có dịch vụ tuyệt vời,5
Một khách sạn đáng trải nghiệm,5
Một khách sạn nhất định phải đến ở Đà Lạt,5
Một khách sạn tốt,5
Một khách sạn tuyệt vời khi đến với Đà Nẵng,5
Một khoảng thời gian tuyệt vời,5
Một khu nghỉ dưỡng tuyệt vời,5
Một khu nghỉ mát tuyệt vời - mọi thứ đều hoàn hảo!,5
Một khu vườn tuyệt vời giữa trung tâm thành phố Đà Lạt,5
Một kì nghỉ dưỡng trọn vẹn,5
Một kì nghỉ đáng nhớ tại Vinpearl Resort and ấp Nha Trang Bay,5
Một kì nghỉ nhiều cảm xúc,5
Một kì nghỉ trên cả tuyệt vời,5
Một kỳ nghỉ ấm cúng,5
Một kỳ nghỉ dễ chịu,5
Một kỳ nghỉ dưỡng tuyệt vời,5
Một kỳ nghỉ đáng nhớ,5
"Một kỳ nghỉ đáng nhớ, tuyệt vời, rất cảm ơn",5
Một kỳ nghỉ hè tuyệt vời,5
Một kỳ nghỉ hoàn hảo,5
Một kỳ nghỉ khó quên,5
một kỳ nghỉ nơi này rất OK và sẽ ghé lại lần sau,5
Một kỳ nghỉ Tết đáng nhớ của gia đình,3
Một kỳ nghỉ thật tuyệt vời,5
Một kỳ nghỉ thú vị,4
Một kỳ nghỉ thư giãn trọn vẹn,5
một kỳ nghỉ trải nghiệm ở resort Hòn Tằm Resort,5
Một kỳ nghỉ trên cả tuyệt vời,5
Một kỳ nghỉ tuyệt vời,5
Một kỳ nghỉ tuyệt vời cho cả gia đình,5
Một kỳ nghỉ tuyệt vời cùng gia đình,5
một kỳ nghỉ tuyệt vời và xuất sắc,5
Một kỳ nghỉ vô cùng thoải mái,5
"một kỳ thư giãn thoải mái, khí hậu trong lành, view cạnh bờ hồ cảm giác bình yên",5
Một lựa chọn tuyệt vời,5
Một mùa hè đầy ý nghĩa với những người bạn tại Tuần châu,5
Một ngày cuối tuần cùng người yêu,5
"Một ngày hoàn hảo với người bạn thân của tôi, view đẹp, rẻ.",5
Một ngày nghỉ tuyệt vời,5
Một ngày Sinh nhật tuyệt vời,5
Một ngày sinh nhật tuyệt vời tại skybar,5
Một ngày trải nghiệm,3
một nơi có thể thư giãn,4
một nơi đáng để đến,5
Một nơi đáng để trải nghiệm,5
Một nơi đáng đến,5
Một nơi đáng đến và đáng quay lại,5
"Một nơi đáng đến, đáng trải nghiệm, và thật sự đáng tiền hơn cả mong đợi",5
Một nơi đáng đồng tiền,5
Một nơi lưu trú rất tuyệt,5
Một nơi nghỉ dưỡng và vui chơi lý tưởng,5
Một nơi rất nên ở để có một chuyến đi Đà Lạt hoàn hảo,5
một nơi thật sự nghỉ dưỡng,5
Một nơi thật tuyệt,5
Một nơi thật tuyệt vời,5
Một nơi thoải mái và thú vị,5
Một nơi thú vị để đến trong mùa hè này,5
Một nơi tốt để ở,5
Một nơi tuyệt vời cho kỳ nghỉ dưỡng,5
Một nơi tuyệt vời để nghỉ dưỡng,5
Một nơi tuyệt vời để nghỉ ngơi,5
"Một nơi xanh, sạch để thư giãn",5
một nơi yên bình,5
Một nơi yên bình nghỉ dưỡng tuyệt vời,5
Một nơi yên tĩnh để ở,4
"Một resort đẹp, lãng mạn và thật sự dễ chịu",5
Một resort phải đến ở Nha Trang,4
Một resort tuyệt vời,5
một số góp ý,3
Một sự lựa chọn cho kỳ nghỉ hè của bạn,4
Một sự lựa chọn hoàn hảo.,5
Một sự trải nghiệm vô cùng thú vị và tuyệt vời,5
Một trải nghiệm đáng nhớ,4
Một trải nghiệm đáng nhớ tại Vinpearl !,5
Một trải nghiệm mới lạ,4
Một trải nghiệm thật tuyệt,5
Một trải nghiệm thật tuyệt vời tại Wink Hotel Danang Centre,5
Một trải nghiệm thú vị,4
Một trải nghiệm tốt,5
Một trải nghiệm tuyệt vời,5
Một trải nghiệm tuyệt vời cho gia đình tôi,5
Một trải nghiệm tuyệt vời cùng khách sạn Sheraton,5
Một trải nghiệm tuyệt vời đối với tôi khi đến đây nghỉ dưỡng cùng bạn bè,5
Một trải nghiệm tuyệt vời khi đến HAVANA,5
Một trong những khách sạn cao cấp nhất Ninh Bình,5
Một vài đánh giá dịch vụ,3
Mới lạ,4
"Mới, sạch, thân thiện",5
mùa hè tuyệt vời,5
Muốn có một kỳ nghỉ thoải mái hãy chọn Sheraton.,5
Muốn quay trở lại,4
Mức độ hài lòng về khu nghỉ dưỡng,4
Mừng Sinh Nhật Chính Chủ,3
"Mường Thanh Huế, trải nghiệm thú vị",4
năm sau sẽ quay lại,4
Nên đến nghỉ dưỡng khi đi Đà lạt,4
Nên ở,4
Nên ở bungalow,4
Nên thử,4
Nên trải nghiệm,4
Nên trải nghiệm nơi đây,4
Nên trải nghiệm vườn hồng ở đây,4
Nếu bạn đi ô tô thì nên cân nhắc,2
"Nếu bạn nhớ Châu âu, đây là nơi tốt nhất",5
Nếu có điều kiện sẽ quay lại,4
Ngay 20/10 đáng nhớ,4
Ngày 20/10 tuyệt vời cùng gia đình,4
Ngày cuối tuần vui vẻ,4
Ngày lễ ấm cúng,3
Ngày lễ của gia đình,3
Ngày Lễ Tết bên gia đình,3
"Ngày Lễ tuyệt vời, nhân viên tốt bụng",4
Ngày sinh nhật đáng nhớ,4
Ngắm view thành phố đà nẵng tại wink,3
"Nghỉ dưỡng cùng gia đình, trải nghiệm tuyệt vời",5
Nghỉ dưỡng khách sạn 5 sao tuyệt vời nhất,5
Nghỉ dưỡng là đây,5
nghỉ dưỡng thả ga,5
Nghỉ dưỡng thảnh thơi,5
Nghỉ dưỡng thật tuyệt,5
Nghỉ dưỡng thì vin là một trong những khách sạn 5 sao hàng đầu và nên đi,5
Nghỉ dưỡng trọn vẹn,5
Nghỉ dưỡng tuyệt vời,5
Nghỉ dưỡng tuyệt vời cùng gia đình,5
Nghỉ dưỡng vui vẻ,5
Nghỉ dưỡng ý nghĩa,5
Nghỉ dưỡng yên bình bên hồ Tuyền Lâm,5
"Nghỉ dưỡng yên tĩnh, cảnh đẹp",5
Ngon,5
"Ngon, đa dạng",5
"Ngon, sẽ quay lại",5
Nhà hàng buffet tầng 25 rất tốt,5
Nhà hàng Dimsum ngon,5
Nhà hàng đã hoạt động trở lại và lợi hại hơn xưa,5
Nhà hàng đẹp,5
Nhà hàng hải sản buffet,5
Nhà hàng rất tuyệt,5
Nhà hàng trên cao,3
Nhà hàng tuyệt vời,5
Nha Trang Bay ngày trở lại,4
Nha Trang cùng gia đình,3
Nha Trang hẹn ngày trở lại,4
Nha trang lần 3,3
Nha trang siêu đẹp…,5
Nha Trang xinh dep,5
"Nhan viên ở đây rất thân thiện, nhiệt tình",5
Nhân viên ấm áp,5
Nhân viên chân thật và chuyên nghiệp,5
Nhân viên chu đáo,5
Nhân viên chuyên nghiệp nhiệt tình,5
"Nhân viên dễ thương, cảnh đẹp, đồ ăn ngon",5
"Nhân viên đẹp trai, lái xe điện bao ngầu",5
Nhân Viên Hết sức dễ thương,5
Nhân viên hỗ trợ tốt,5
Nhân viên khách sạn,5
"Nhân viên khách sạn nhiệt tình, vị trí khách sạn và view đẹp",5
"Nhân viên khách sạn thân thiện nhiệt tình, rất hài lòng",5
Nhân viên lễ tân không thân thiện và khó chịu với khách,5
Nhân viên lễ tân tuyệt vời,5
Nhân viên người Hàn Quốc rất thân thiện.,5
Nhân viên nhà hàng rất nhiệt tình,5
Nhân viên nhiệt tình chu đáo.,5
Nhân viên nhiệt tình dễ thương,5
"Nhân viên nhiệt tình và thân thiện, ăn sáng ngon, vệ sinh sạch",5
"Nhân viên nhiệt tình, dịch vụ tuyệt vời.",5
"Nhân viên nhiệt tình, thân thiện",5
Nhân viên phục vụ rất thân thiện,5
Nhân viên phục vụ tận tình,5
"Nhân viên phục vụ tận tình chu đáo, phòng ốc thì khỏi nói quá sang trọng và sạch sẽ.",5
"Nhân viên phục vụ tận tình và chu đáo, có thể gửi xe máy ở khách sạn.phòng sạch sẽ,đầy đủ tiện nghi",5
"Nhân viên phục vụ tận tình, chuyên nghiệp",5
Nhân viên phục vụ tốt,5
Nhân viên quá nhiệt tình và có tâm,5
nhân viên rất nhiệt tình,5
Nhân viên rất thân thiện,5
Nhân viên siêu dễ thương,5
Nhân viên thân thiện nhiệt tình,5
Nhân viên thân thiện phòng đẹp,5
Nhân viên thân thiện và chuyên nghiệp,5
"Nhân viên thân thiện, cực kì dễ thương.",5
"Nhân viên thân thiện, khách sạn đẹp, phục vụ hoàn hảo",5
"Nhân viên thân thiện, khách sạn sạch, đẹp",5
"Nhân viên thân thiện, món bánh canh chả cá cần cải thiện",4
"Nhân viên thân thiện, nhiệt tình.món ăn ngon, đa dạng, phong phú, phòng đẹp,cảnh đẹp",5
"Nhân viên thân thiện, sạch sẽ, tiện nghi.",5
"Nhân viên thân thiện, tác phong chuyên nghiệp",5
"Nhân viên thân thiện, vị trí tuyệt vời",5
nhân viên tốt,5
Nhân viên tuyệt tuyệt vời,5
Nhân viên tư vấn không chuyên nghiệp,2
"Nhân viên vui vẻ , resort sạch sẽ",5
Nhận xét chất lượng dịch vụ tốt,5
Nhận xét về khách sạn,3
Nhất định phải ở,5
Nhẹ nhàng và thoải mái thư giãn với không gian đẹp,5
"Nhiệt tình, thân thiện và chu đáo",5
Nhiều trải nghiệm thú vị và bánh pana chanh dây,4
Nhìn chung hài lòng,4
"Nhìn chung khách sạn rất xứng đáng so với giá tiền bỏ ra, có vẻ tốt hơn nhiều khách sạn tiêu chuẩn 3 sao khác.",4
"Nhìn chung là một chỗ rất đáng để đến nghỉ dưỡng thích hợp cặp đôi và gia đình, tuy nhiên resort nên ghi rõ thêm thông tin",4
nhìn chung mọi thứ đều tuyệt vời,5
Những Cảm nhận của tôi,3
Những chia sẻ trong thời gian lưu trú tại Vinpearl Bay,3
"Những gì bạn thấy trên ảnh, bên ngoài còn đẹp hơn",5
Những giây phút tuyệt vời bên gia đình tại Amiana Resort and villas,5
Những ngày nghỉ dưỡng tại Vinpearl Nha Trang.,3
Những ngày nghỉ dưỡng tuyệt vời,5
"Những ngày ở Ana Mandara cả gia đình mình đã có kỳ nghỉ rất tuyệt vời",5
Những trải nghiệm tuyệt vời,5
Những trải nghiệm tuyệt vời khi lần đầu đến La Vela Sài Gòn,5
Niềm vui khi được phục vụ tốt,5
Niềm vui về đêm,5
nói chung là vui,5
"Nội thất của phòng rất tuyệt vời, mọi thứ đều tiện ích.",5
Nơi bạn nên ghé thăm khi đến Huế,4
Nơi bình yên giữa trung tâm Đà Lạt,4
Nơi cảm xúc thăng hoa,5
Nơi có bãi biển cực đẹp,5
Nơi có dịch vụ tốt,1
Nơi của sự gặp gỡ,4
Nơi duy nhất ở Đà Lạt còn lưu giữ được vẻ đẹp,5
Nơi dừng chân lý tưởng,5
nơi đáng để đến nghỉ mát hằng năm,5
Nơi đáng để lựa chọn.,5
Nơi đáng để lưu trú,5
"Nơi đáng để mọi người trải nghiệm ạ, 10 điểm ạ",5
Nơi đáng để nghỉ ngơi,5
Nơi đáng nghỉ dưỡng,5
Nơi đáng ở khi ghé Đà lạt,5
Nơi đáng ở tại Nha Trang,5
"Nơi đây luôn là điểm tôi luôn chọn nghỉ ngơi mỗi khi tôi
lên Đà Lạt",5
"Nơi đây ở rất thích , nhiều địa điểm sống ảo , phù hợp nghỉ dưỡng",5
Nơi để quay về với Đà Lạt,4
"Nơi hết sức tuyệt vời, bạn nhất định phải ghé thăm một lần",5
Nơi khởi đầu hạnh phúc,5
Nơi làm việc lý tưởng,5
Nơi lưu trú tuyệt vời khi đến Nha Trang,5
Nơi lý tưởng để gặp nhau giữa tuần cùng hội bạn,5
Nơi lý tưởng để nghỉ ngơi,5
Nơi lý tưởng tại Sài Gòn,5
Nơi nên đến,4
Nơi nghỉ chân tuyệt vời,5
Nơi nghỉ dưỡng đẹp,5
nơi nghỉ dưỡng lý tưởng cho gia đình và người yêu,5
"Nơi nghỉ dưỡng lý tưởng cho gia đình, người thân",5
Nơi nghỉ dưỡng thích hợp dành cho gia đình,4
Nơi nghỉ dưỡng trên cả tuyệt vời,5
Nơi nghỉ dưỡng tuyệt vời,5
Nơi nghỉ dưỡng tuyệt vời cho cả gia đình,5
Nơi nghỉ dưỡng tuyệt vời cho gia đình,5
Nơi nghỉ dưỡng tuyệt vời và thú vị,5
"Nơi nghỉ dưỡng tuyệt vời, hạn chế về ẩm thực",4
Nơi nghỉ dưỡng ưa thích,5
Nơi nghỉ dưỡng yên tĩnh,4
Nơi nghỉ lí tưởng,5
Nơi nghỉ ngơi lý tưởng cho gia đình,5
Nơi nghỉ ngơi thú vị khi du lịch đến Đà Lạt,5
Nơi nghỉ ngơi tốt,5
Nơi nghỉ ngơi tuyệt vời,5
Nơi ngự trị Thiên đường,5
Nơi ở đáng giá,5
"Nơi ở đáng tiền , Tiện nghi.",4
Nơi ở đẹp nhưng xa trung tâm,4
"Nơi ở đẹp rất tiện nghi, đã ở 2 lần, lần này ở cả 3 đêm. Thức ăn ngon",5
"Nơi ở đẹp, phong cảnh rất tuyệt vời,tiện nghi tốt.",5
Nơi ở gần gũi thiên nhiên,5
Nơi ở tốt gần bãi tắm sạch,5
Nơi ở tuyệt vời,5
Nơi ở tuyệt vời nên đến khi du lịch Đà Lạt,5
Nơi thích hợp để tổ chức các buổi họp và sự kiện,5
Nơi thích hợp nghỉ dưỡng,5
Nơi thư giãn tuyệt vời trong cuộc sống của tôi,5
Nơi tôi rất thích,5
nơi tốt để ở,5
Nơi tốt nhất để bạn thư giãn,5
Nơi tốt nhất từng đi,5
Nơi Trải Nghiệm nghỉ dưỡng tuyệt vời,5
Nơi tuyệt hảo là đây,5
Nơi tuyệt vời,5
Nơi tuyệt vời để nghỉ dưỡng,5
nơi tuyệt vời để ở,5
Nơi tuyệt vời để thử món ăn đặc biệt.,5
Nơi yên bình ngay trung tâm Đà Lạt,4
Nơi yên tĩnh,4
Nơi yêu thích của tôi ở Đà Lạt,5
nước biển trong xanh,3
"Nước ngon, phục vụ tốt",5
Ok,5
Ôm trọn lòng cố đô qua cửa sổ Skybar Vinpearl Hotel Hue,4
Ổn áp,4
Ổn giá tốt. xa trung tâm,4
Ổn so với đà lạt,4
"Ồn, đồ ăn sáng chán, nhân viên không chuyên nghiệp",2
"ổn, ở khách sạn rất ổn",4
"ở đây rất đẹp và sạch thích hợp cho cặp tình nhân hoặc thích yên tĩnh",5
Ở được,4
"Ở giữa rừng thông vi vu, nhiều hoa lá, tiểu cảnh đẹp chụp
ảnh.",5
Ở trung tâm nên thuận tiện đi vào các khu vực trung tâm,4
"Ở trung tâm, sạch sẽ và yên tĩnh",5
PARADISE SUITES HOTEL quá tuyệt vời ! hy vọng sớm gặp lại các bạn,5
Park Lounge- dịch vụ Đặc biệt,4
Phải đến Huế,4
phải thử,4
phản hồi về chất lượng resort,3
Phiêu bar tầng 1 rất đáng trải nghiệm,4
"Phòng Bugalow đẹp, view thiên nhiên",5
Phong cách phục vụ,3
"Phong cách sang trọng, riêng tư, tiện lợi gần trung tâm",5
"Phong cách, ấm cúng",5
"Phong cảnh đẹp, đồ ăn bình thường",5
"Phong cảnh đẹp, phù hợp nghỉ dưỡng",5
"Phong cảnh hữu tình, resort êm ái",5
phong cảnh tốt - Dịch vụ tốt,5
phong cảnh tuyệt vời,5
Phòng Deluxe rất xinh,5
"Phòng đầy đủ tiện nghi, có hồ bơi ấm, view hồ bơi đẹp, thức ăn ngon, view nhà ăn đẹp",5
"Phòng đẹp , nhân viên cực tốt , vệ sinh",5
Phòng đẹp khi đêm xuống,5
Phòng đẹp và nhân viên phục vụ chuyên nghiệp,5
Phòng đẹp và nhân viên thân thiện,5
Phòng đẹp và quầy bar sang trong,5
Phòng đẹp và thân thiện,5
"Phòng đep, dịch vụ tốt",5
"Phòng đẹp, đồ ăn ngon, nhân viên nhiệt tình",5
"Phòng đẹp, gần chợ",5
"Phòng đẹp, nhân viên dễ thương cực kì, hỗ trợ mình tích cực nâng cấp hạng phòng view đẹp",5
"Phòng đẹp, nhân viên lịch sự",5
"Phòng đẹp, nhìn ra biển",5
"Phòng đẹp, sạch sẽ khách sạn rộng, thoáng mát, có chỗ cho trẻ con vui chơi vì gia đình",5
"Phòng đẹp, view đẹp, nhân viên phục vụ nhiệt tình, chu đáo",5
Phòng gác mới rất tuyệt,5
phòng họp chuyên nghiệp,5
Phòng hội nghị chuẩn quốc tế,5
Phòng hội thảo chuyên nghiệp,5
Phòng hướng view biển,3
Phòng khách sạn rất đẹp,5
Phòng nghỉ rộng rãi thoải mái,5
Phòng ngủ tuyệt vời,5
Phòng ốc rộng rãi đẹp nhất là khu villa,5
"Phòng ốc sạch sẽ, nhân viên thân thiện, xa trung tâm, vô hẻm xa.",4
Phòng ở hơi bí,4
Phòng rất đẹp nhưng vắng vẻ,4
"Phòng rất sạch, nhân viên nhiệt tình",5
"Phòng rộng , sạch đẹp, khung cảnh thơ mộng thích hợp cho
nghỉ dưỡng.",5
Phòng rộng rãi thoải mái,5
Phòng rộng thoải mái,5
"Phòng rộng, sạch sẽ, phù hợp cho gia đình",5
"Phòng rộng, thoải mái , cảnh thiên nhiên thơ mộng",5
Phòng sạch đẹp,5
Phòng sạch sẽ nhưng chăn ga ở đây hơi dày,2
Phòng sạch sẽ thoáng mát.,5
Phòng sạch sẽ và nhân viên thân thiện.,5
"Phòng sạch sẽ, nhân viên thân thiện",5
"Phòng sạch, dịch vụ tốt",5
"Phòng sạch, đẹp, nhân viên nhiệt tình",5
"Phòng thoáng, đẹp, đầy đủ tiện nghi",5
"Phòng tiện nghi, thoáng, sạch sẽ",5
Phòng tiêu chuẩn và bể bơi đẹp,5
"phòng tốt, đẹp, sạch . nhân viên nhiệt tình",5
phòng tuyệt đẹp,5
Phòng tuyệt vời. Đồ ăn buffet ngon và phong phú,5
phòng view đẹp,5
"Phòng xinh xắn, view nhà hàng đẹp.",5
Phở chọc trời ngon nhất Sài Gòn,5
Phù hợp cho du lịch kiểu gia đình,5
Phù hợp cho gia đình có em bé và nghỉ dưỡng,5
Phù hợp cho gia đình nghỉ dưỡng,5
Phù hợp cho nghỉ dưỡng,5
phù hợp cho nhiều đối tượng,5
Phù hợp để nghỉ dưỡng,5
Phù hợp để nghỉ dưỡng trong trung tâm,5
"Phù hợp đi nghỉ ngơi, yên tĩnh",5
Phù hợp giá tiền,5
Phù hợp nghỉ dưỡng,5
"Phù hợp nghỉ dưỡng lãng mạn cho cặp đôi, gần gũi thiên
 nhiên cho gia đình",5
Phù hợp với du lịch nghỉ dưỡng,5
Phù hợp với giá tiền,5
Phù hợp với sở thích của tôi,5
Phù hợp với túi tiền,5
Phục vụ chuyên nghiệp,5
Phục vụ nhiệt tình,5
Phục vụ rất chuyên nghiệp và chu đáo,5
Phục vụ rất nhiệt tình chu đáo,5
"Phục vụ rất tốt, chuyên nghiệp",5
Phục vụ rất tốt.,5
"Phục vụ tốt , chuyên nghiệp - không gian sang trọng địa điểm thuận lợi đi lại cho mọi người và mọi công việc.",5
Phục vụ tốt nhiệt tình dễ thương,5
Phục vụ tuyệt vời,5
"Phục vụ tuyệt vời, khung cảnh đẹp, nhà hàng ăn sáng phong phú",5
Quá đẹp và lãng mạn,5
Quá đỉnh,5
Quá đỉnh cho 1 chuyến đi gia đình,5
Quá hài lòng và đáng giá,5
Quá hài lòng và đáng nhớ,5
Quá hài lòng với trải nghiệm 5 sao cùng Mermaid,5
Quá ổn với tầm tiền,5
Quá tốt,5
Quá tốt và view biển cực đẹp,5
"Quá tuyệt vời ,sẽ ghé lại nhiều lần",5
Quá tuyệt vời cho một kỳ nghỉ tại Nha Trang,5
Quá tuyệt vời khi đến với Emm hotel,5
"Quá tuyệt vời, xuất sắc, chu đáo, nhiệt tình, đồ ăn đa dạng, quầy bar nhân viên rất nhiệt tình, nhiều thứ để trải nghiệm",5
Quá xuất sắc cho 1 kỳ nghỉ gia đình,5
Quang cảnh tuyệt đẹp,5
Quay lại lần 2,4
Quay lại lần 2 rất ok,5
Quay lại lần nữa,4
Quay lại Vinpearl nhiều lần và rất hài lòng.,5
Quay về với thiên nhiên ở Amiana Resort,4
Rất bất tiện khi hotel không có ăn sáng.,1
Rất buồn các bạn nhân viên nhà hàng,1
"Rất cảm ơn khách sạn đã tận tình và chu đáo để gia đình có kỳ nghỉ dưỡng thoải mái.",5
Rất chu đáo,5
rất đáng để chọn khi bạn du lịch ở Nha Trang,5
Rất đáng để đi,5
Rất đáng để lưu trú,5
Rất đáng để quay lại,5
Rất đáng để quay lại nhiều lần,5
Rất đáng để trải nghiệm,5
Rất đáng đồng tiền,5
Rất đáng giá so với giá tiền,5
Rất đáng giá tiền,5
Rất đáng tiền để ở,5
Rất hài lòng,5
Rất hài lòng khi chọn Sheraton Nha Trang làm nơi lưu trú cho kì nghỉ hè của gia đình,5
Rất hài lòng ở Êmm Huế và xứng đáng được giới thiệu,5
Rất hài lòng và sẽ quay lại,5
Rất hài lòng về kỳ nghỉ tại Vinpearl,5
Rất hài lòng về kỳ nghỉ.,5
Rất hài lòng về mọi mặt,5
Rất hài lòng với dịch vụ,5
Rất hài lòng với khách sạn,5
Rất hài lòng với nhân viên và các dịch vụ khách sạn,5
"Rất hài lòng, kỳ nghỉ thú vị",5
"Rất hài lòng, sẽ quay lại",5
rất hài lòng.,5
Rất hấp dẫn,5
Rất khuyến khích,5
Rất là tốt,5
Rất ok,5
"Rất phù hợp cho gia đình vui chơi, nghỉ dưỡng",5
Rất rất hài lòng.,5
Rất rất thích,5
"Rất sạch sẽ,vị trí thuận tiện",5
Rất Thanh lịch,5
Rất thích,5
Rất thích hợp để nghỉ dưỡng,5
"Rất thích không gian của Amiana, dịch vụ và chất lượng đều rất tuyệt vời, sẽ quay lại vào dịp tới",5
Rất thích thái độ phục vụ của nhân viên tại Havana,5
Rất thích villa ,5
Rất thỏai mái,5
Rất thoải mái khi ở đây,5
Rất thoải mái và sẽ quay lại lần tới,5
rất thoải mái và thư giãn,5
"Rất thư giãn, lãng mạn, đẹp",5
rất tốt,5
Rất tốt 5 sao,5
Rất tốt ạ.,5
Rất tốt trong tầm giá,5
"Rất tốt và phục vụ rất tuyệt vời, service rất hài lòng",5
Rất tốt và sạch sẽ,5
"Rất tốt, navada hãy cứ giữ phong độ",5
"Rất tốt, sẽ quay lại",5
"Rất tốt, tiêu chuẩn quốc tế",5
rất tốt. mẹ tôi rất hài lòng,5
Rất tuyệt,5
rất tuyệt vời cho những người yêu kiến trúc cổ điển Pháp,5
Rất tuyệt vời và Ấn tượng,5
"Rất tuyệt vời với những dịch vụ chất lượng và chuyên nghiệp, cảm ơn các bạn",5
"Rất tuyệt vời, hơn cả sự mong đợi của mình.",5
Rất vui đã ở đây,5
Rất vui khi ở vinpearl hạ long,5
Rất vui và hài lòng.,5
"Rất vui vì khi nhận phòng được quen thêm hai bạn mới ,mặc dù mình đi 1 mình, Nhất định sẽ quay lại",5
"Rất xứng đáng, sẽ quay lại",5
Rất yên bình giữa trung tâm thành phố Đà Lạt,4
"Rẻ , sạch sẽ ,tiện nghi .",5
Resort bên bãi biển,3
Resort chuẩn 5 sao,5
Resort có vị trí đẹp,5
Resort có view đẹp,4
Resort cổ - không khí khá thoáng,4
Resort dễ thương,5
Resort đáng giá để chọn nghỉ dưỡng,5
Resort đạt chuẩn,5
Resort đẹp - Dịch vụ chuyên nghiệp,5
Resort đẹp đáng để nghỉ dưỡng,5
"Resort đẹp đồ ăn ngon, nếu không muốn ra ngoài ăn thì các món ăn tối cũng vừa giá tiền",5
Resort đẹp nhất ở Đà Lạt,5
Resort đẹp nhưng đồ ăn rất tệ,2
Resort đẹp và đạt tiêu chuẩn 4 sao.,5
Resort đẹp và sạch sẽ,5
Resort đẹp yên tĩnh,5
"Resort đẹp, dịch vụ chưa tốt",2
"Resort đẹp, đầy đủ tiện nghi, cần cải thiện về đồ ăn",4
"Resort đẹp, không gian thoáng đãng",5
"Resort đẹp, nhân viên cực kỳ thân thiện, buffet sáng ngon",5
"Resort đẹp, sạch, và thân thiện.",5
"Resort đẹp, yên tĩnh",5
Resort gần ngay trung tâm,3
Resort gần trung tâm,3
Resort hài lòng nhất tại Nha Trang,5
Resort Hòn Tằm Nha Trang,3
"Resort mát, cảnh đẹp, yên tĩnh.",5
"Resort nằm trên đồi riêng, khung cảnh nên thơ, thoáng đãng.",5
Resort nên chọn khi đến Đà Lạt,4
Resort nghỉ dưỡng,3
Resort nghỉ dưỡng khá tốt,4
"Resort OK, cần duy trì và cải thiện thêm một vài chi tiết nhỏ.",2
"Resort ở vị trí tuyệt vời nhưng nếu bạn thích sự hiện đại tiện nghi thì nên cân nhắc",4
"Resort phong cách ""Tây"" rất tuyệt vời",5
resort quá tệ không đạt tiêu chuẩn 5 sao,1
Resort quá tuyệt vời về vẻ đẹp và dịch vụ,5
Resort rất đẹp,5
Resort rất đẹp,5
"Resort rất đẹp và mọi người đều rất vui vẻ, nhiệt tình",5
"Resort rất đẹp, đáng yêu phù hợp với cặp đôi, không phù hợp trẻ nhỏ",5
"Resort rất đẹp, nhân viên thân thiện và nhiệt tình",5
"Resort rất đẹp, tiện nghi",5
resort rất lãng mạn,5
Resort rất ổn đáng để thử,4
"Resort rộng lớn, xanh tươi, giữa hồ tuyền lâm.",5
"Resort sạch đẹp, nhân viên nhiệt tình, thích hợp nghỉ dưỡng",5
"Resort sạch đẹp, nhân viên thân thiện",5
resort siêu dễ thương,5
Resort tiện nghi và khung cảnh đẹp,5
Resort tốt,5
Resort tốt nhất,5
Resort tốt và đáng giá,5
Resort tuyệt đẹp,5
resort Tuyệt và nhân viên dễ thương,5
Resort tuyệt vời,5
Resort với hồ bơi rất đẹp,5
"Resort yên bình, gần gũi thiên nhiên",5
"Resort yên tĩnh, view đẹp, sạch sẽ, nhân viên nhiệt tình",5
Resort yêu thích nhất của mình ở Đà Lạt,5
Review khách sạn,3
Review khu Nha Trang Vinpearl,3
"Rộng rãi, thoáng mát , khung cảnh thiên nhiên đẹp",5
"Rộng rãi, thoáng mát và sang trọng",5
Sạch,4
"Sạch đẹp, thích hợp cho trẻ nhỏ",5
sạch sẽ,4
Sạch sẽ,4
"Sạch sẽ ,Đẹp , cổ điển",5
sạch sẽ nhưng hơi xa,4
Sạch sẽ thân thiện,5
Sạch sẽ và thân thiện,5
Sạch sẽ và tiện lợi,5
Sạch sẽ và tiện nghi,5
"Sạch sẽ, dịch vụ tốt",5
"Sạch sẽ, đẹp, tiện nghi, thoải mái",5
"Sạch sẽ, gần trung tâm",5
"Sạch sẽ, thơm tho, mát mẻ, ngon, chuyến đi rất thú vị, nhanh chóng, chuyên nghiệp, đẳng cấp thế giới, nhân viên rất tốt.",5
