Text,Label
Khách sạn đạt chuẩn 5 sao,5
"Khách sạn đạt tiêu chuẩn 5 sao ,phục vụ rất tốt như phòng ,ẩm thực ,các dịch vụ rất tốt đạt tiêu chuẩn ,nhân viên nhiệt",5
Khách sạn đẳng cấp,5
Khách sạn đẳng cấp 5 sao,5
"Khách sạn đầy đủ tiện nghi, dịch vụ phong phú",5
Khach san đẹp,5
Khách sạn đẹp,5
"Khách sạn đẹp , dịch vụ tốt, nhân viên ân cần",5
"Khách sạn đẹp , nhân viên phục vụ tốt, lễ tân tạm ổn",5
Khách sạn đẹp an toàn,5
"Khách sạn đẹp chuẩn, dịch vụ rất hài lòng",5
khách sạn đẹp dịch vụ tốt,5
Khách sạn đẹp nhân viên dễ thương.,5
Khách sạn đẹp nhân viên thân thiện,5
Khách sạn đẹp nhất Đà Lạt,5
Khách sạn đẹp nhất ở Tuần Châu,5
Khách sạn đẹp thoáng mát,5
khách sạn đẹp và chất lượng,5
Khách sạn đẹp và chuyên nghiệp,5
Khách sạn đẹp và phục vụ rất thân thiện,5
Khách sạn đẹp và sạch sẽ,5
khách sạn đẹp và sang trọng,5
Khách sạn đẹp và thân thiện,5
Khách sạn đẹp và thoáng mát,5
Khách sạn đẹp và yên tĩnh,5
Khách sạn đẹp với các villa cổ,5
"Khách sạn đẹp, chất lượng tốt, nhân viên nhiệt tình",5
"Khách sạn đẹp, dịch vụ tốt",5
"Khách sạn đẹp, dịch vụ tốt",5
"Khách sạn đẹp, dịch vụ tuyệt vời",5
"Khách sạn đẹp, đáng trải nghiệm",5
"Khách sạn đẹp, lãng mạn",5
"Khách sạn đẹp, ngay trung tâm thành phố, thức ăn ngon, nhân viên nhiệt tình, thân thiện",5
"Khách sạn đẹp, nhân viên nhiệt tình.",5
"Khách sạn đẹp, nhân viên thân thiện",5
"Khách sạn đẹp, phục vụ rất tốt.",5
"Khách sạn đẹp, rẻ, chill",5
"Khách sạn đẹp, sạch sẽ",5
"Khách sạn đẹp, sạch sẽ và yên tĩnh",5
"Khách sạn đẹp, thuận tiện đi lại, thích hợp nghỉ dưỡng",5
"Khách sạn đẹp, tiện nghi",5
"khách sạn đẹp, tiện nghi, khá khiêm tốn",5
"Khách sạn đẹp, tôi rất hài lòng.",5
"Khách sạn đẹp, tốt, nhân viên nhiệt tình",5
"Khách sạn đẹp, tuyệt vời",5
"Khách sạn đẹp, vị trí tốt",5
"Khách sạn đẹp, yên tĩnh",5
"Khách sạn đúng tiêu chuẩn, nhân viên nhiệt tình dễ mến.",5
Khách sạn gần bến tàu tiện lợi,5
Khách sạn gần trung tâm,5
"Khách sạn gói gọn trong rừng thông ở hồ tuyền lâm với đầy đủ các dịch vụ tiện ích",5
Khách sạn hạng sang kiểu cổ điển,5
Khách sạn Havana- Dịch vụ tốt nhất từ ​​trước đến nay,5
Khách sạn hiện đại,5
Khách sạn Hiện đại - Tiện nghi,5
Khách sạn hiện đại mới sạch sẽ view đẹp,5
"Khách sạn hiện đại, kỳ nghỉ tuyệt vời",5
"Khách sạn hiện đại, mới lạ",5
"Khách sạn hiện đại, sạch sẽ",5
"Khách sạn hiện đại, view siêu đỉnh, nhân viên nhiệt tình, chắc chắn sẽ giới thiệu cho bạn bè khi tới Đà Nẵng",5
Khách sạn hoàn hảo,5
Khách sạn hoành tráng,5
Khách sạn khá ok,5
Khách sạn khá ổn,4
"Khách sạn khá tiện nghi, bài trí hiện đại",5
Khách sạn khá xa trung tâm,5
Khách sạn kiểu mới,5
"Khách sạn La Vela rất đáng để ở, nên đến trải nghiệm",5
"Khách sạn La Vela, điểm đến lý tưởng",5
"Khách sạn lãng mạn, yên tĩnh, chất lượng tốt",5
"Khách sạn luôn sẵn sàng cho mọi thứ thật chu đáo, nhiệt tình.",5
Khách sạn lý tưởng,5
Khách sạn lý tưởng cho kỳ nghỉ trăng mật.,5
"Khách sạn mặt biển, nhân viên thân thiện hỗ trợ tốt",5
Khách sạn mới,5
Khách sạn mới,5
"Khách sạn mới đẹp, sạch sẽ, sẽ quay lại lần sau",5
"Khách sạn mới đẹp, vị trí đẹp, tốt",5
Khách sạn mới hiện thân thiện gần gũi môi trường,5
Khách sạn mới ở Đà Nẵng,5
Khách sạn mới sạch sẽ,5
"Khách sạn mới sạch sẽ, nhân viên siêu dễ thương và nhiệt tình",5
"Khách sạn mới sạch sẽ, view đẹp và đáng giá tiền",5
"khách sạn mới, dễ thương",5
"Khách sạn mới, hiện đại nhưng cách âm kém và xa trung tâm",2
"Khách sạn mới, sạch sẽ",5
"Khách sạn mới, sạch sẽ và hiện đại",5
"Khách sạn mới, tuyệt vời",5
Khách sạn này là một nơi tốt.,5
Khách sạn nằm ngay trung tâm,5
Khách sạn nên cải thiện một số lưu ý sau,2
Khách sạn nên ở tại Hà Nội trong tôi.,5
Khách sạn ngàn sao,5
Khách sạn ngay Trung tâm thành phố,5
"Khách sạn ngay trung tâm, dịch vụ tuyệt vời",5
Khách sạn nghỉ dưỡng,5
Khách sạn nghỉ dưỡng tuyệt vời,5
Khách sạn nhà người ta không làm bạn thất vọng,5
Khách sạn nhân viên thân thiện,5
Khách sạn ổn,5
"Khách sạn ổn , phòng giống hình , rất sạch sẽ , giường rộng , view đẹp , bữa sáng ngon . đa dạng .",5
"Khách sạn ổn, đáng giá tiền",5
Khách sạn ở vị trí đẹp,5
"Khách sạn phong cách năng động, trẻ trung, độc lạ, phong cách Nhật",5
"Khách sạn phong cảnh đẹp, lãng mạn.",5
Khách sạn phù hợp cho các cặp đôi,5
Khách sạn phù hợp với các gia đình,5
khách sạn phục vụ rất tốt,5
Khách sạn quá đẹp,5
Khách sạn quá tuyệt vời,5
Khách sạn quá tuyệt vời trong tầm giá,5
"Khách sạn rất chu đáo, nhiệt tình",5
Khách sạn rất đáng giá tiền,5
"Khách sạn rất đẹp, sạch sẽ",5
Khách sạn rất ổn áp,4
Khách sạn rất thoải mái.,5
"Khách sạn rất tốt , nhân viên lễ tân khách sạn nhiệt tình mến khách",5
Khách sạn rất tốt nhưng không phải trải nghiệm 5 sao,4
Khách sạn rất tốt tại Thành phố Nha Trang,5
Khách sạn rất tốt và tiện nghi,5
"khách sạn rất tốt, nhiệt tình tiện nghi",5
"Khách sạn rất tốt, sẽ quay lại",5
Khách sạn rất tuyệt,5
Khách sạn rất tuyệt vời,5
Khách sạn rất ưng ý,5
"Khách sạn rộng rãi, phòng sạch sẽ, nhân viên rất nhiệt tình",5
Khách sạn sạch đẹp,5
Khách sạn sạch sẽ,5
Khách sạn sạch sẽ,5
"Khách sạn sạch sẽ , thân thiện",5
"Khách sạn sạch sẽ tiện ích, view đẹp, sẽ quay lại khi đến Đà Lạt",5
Khách sạn sạch sẽ yên tĩnh,5
"Khách sạn sạch sẽ, đồ dùng cũ",4
"Khách sạn sạch sẽ, gần chợ",5
"khách sạn sạch sẽ, gần chợ tiện lợi dạo phố",5
"Khách sạn sạch sẽ, nhân viên dễ thương, phong cảnh tuyệt đẹp",5
"Khách sạn sạch sẽ, nhân viên thân thiện",5
"khách sạn sạch sẽ, thoáng",5
"khách sạn sạch sẽ, tiện nghi",5
"khach san sạch sẽ, tiện nghi, giá cả phù hợp",5
"Khách sạn sạch sẽ, trang thiết bị tốt",5
"Khách sạn sạch sẽ, view đẹp chuẩn",5
Khách sạn sạch thoáng và thoải mái.,5
Khách sạn sang chảnh bậc nhất ở thành phố Huế,5
Khach san sang trong,5
Khách sạn sang trọng và sạch sẽ,5
"Khách sạn sang trọng, giá cả hợp lý",5
"Khách sạn sang trọng, tiện nghi và đồ ăn ngon",5
Khách sạn Sheraton là sự chọn tuyệt vời,5
Khách sạn siêu xinh và dịch vụ tốt,5
"khách sạn sử dụng phong cách cổ kính, không gian đẹp",5
Khách sạn tạo nên điều kỳ diệu,5
Khách sạn thanh lịch 2 phục tốt và thuận tiện,5
Khách sạn thân thiện,5
Khách sạn thân thiện và đẹp,5
"Khách sạn thân thiện, dịch vụ nhanh chóng",5
"Khách sạn thân thiện, sạch đẹp",5
Khách sạn thật tuyệt,5
khách sạn thích hợp cho doanh nhân,3
Khách sạn thích hợp cho nghỉ dưỡng xa trung tâm,5
Khách sạn thiên đường,5
Khách sạn thiết kế rất rất đẹp,5
Khách sạn thiết kế rất xinh đẹp,5
Khách sạn thông minh,5
Khách sạn thông minh mới lạ hiện đại,5
"Khách sạn thơ mộng, yên tĩnh, thư giãn tốt",5
Khách sạn thú vị,5
Khách sạn tiện nghi,5
Khách sạn tiện nghi hơn so với mình nghĩ,5
Khách sạn tiêu chuẩn,5
"Khách sạn tiêu chuẩn tốt, thái độ nhân viên kém",5
Khách sạn tọa lạc vị trí đẹp,5
"Khách sạn tốt , nhân viên chu đáo",5
Khách sạn tốt chất lượng tuyệt vời,5
Khách sạn tốt cho nghỉ dưỡng gia đình và cặp đôi,5
Khách sạn tốt đáng giá tiền,5
Khách sạn tốt đẹp,5
Khách sạn tốt để ở trong thời gian ngắn,5
Khách sạn Tốt để trải nghiệm,5
Khách sạn tốt nhân viên nhiệt tình,5
Khách sạn tốt nhất,5
Khách sạn tốt nhất cho gia đình,5
Khách sạn tốt nhất để ở tại Huế,5
Khách sạn tốt nhất nên ở tại Huế,5
Khách sạn tốt nhất Nha Trang,5
Khách sạn tốt nhất ở nha trang,5
Khách sạn tốt nhất ở Sài Gòn,5
Khách sạn tốt nhất thành phố!,5
Khách sạn tốt nhất trong tầm giá,5
Khách sạn tốt sạch nhân viên thân thiện,5
Khách sạn tốt tại Nha Trang,5
Khách sạn tốt tại Thành phố Huế,5
Khách sạn tốt thuận tiện,5
"Khách sạn tốt, 4 sao cho dịch vụ",5
"Khách sạn tốt, đáng tiền",5
"Khách sạn tốt, nhân viên thân thiện",5
"Khách sạn tốt, tuy nhiên Agoda cần cải thiện",4
"Khách sạn tốt, vị trí trung tâm Thành phố Huế",5
Khách sạn trẻ trung cá tính,5
Khách sạn trẻ trung màu sắc,5
Khách sạn trẻ trung năng động,5
"Khách sạn trên đảo, nhưng biển không tắm được vì dơ",2
Khách sạn trung tâm thành phố huế.,5
Khách sạn tuyệt vời,5
Khách sạn tuyệt vời,5
Khách sạn tuyệt vời nhất mà tôi từng đến,5
Khách Sạn tuyệt vời nhất ở Nha Trang,5
Khách sạn tuyệt vời ở Đà Nẵng,5
Khách Sạn tuyệt vời tại trung tâm thành phố Đà Nẵng,5
Khách sạn tuyệt vời tại trung tâm thành phố Huế,5
Khách sạn tuyệt vời với hồ bơi vô cực trên tầng thượng,5
"Khách sạn tuyệt vời, phòng rộng, sạch",5
Khách sạn ưa thích,5
Khách sạn vị trí đẹp,5
Khách sạn vị trí trên đồi yên tĩnh,5
Khách sạn View Cầu Rồng đẹp tại Đà Nẵng,5
Khách sạn view đẹp,5
"Khách sạn view đẹp, nhân viên tiếp đón khách chu đáo",5
"Khách sạn view đẹp, sang trọng.",5
"Khách sạn view đẹp, yên tĩnh, thích hợp nghỉ dưỡng",5
"khách sạn vinpearl tuyệt vời, đẳng cấp 5 sao",5
Khách sạn với vị trí thuận tiện và phòng có khung cảnh hướng sông đẹp,5
Khách sạn với view thung lũng,5
"Khách sạn xây trên triền núi, hướng ra thung lũng nhỏ, gia đình có trẻ nhỏ hợp vì nhiều cây và yên tĩnh",5
Khách sạn xịn mịn,5
Khách sạn xịn ở Đà Lạt,5
Khách sạn xinh đẹp và ấn tượng,5
Khách sạn xứng đáng với mức tiền bỏ ra,5
Khách sạn yên tĩnh,5
"Khách sạn yên tĩnh sạch sẽ, nhân viên nhiệt tình, chu đáo.",5
Khách sạn yên tĩnh và xanh mát,5
Khách sạn yêu thích của tôi,5
Khách sạn yêu thích khi tới Đà Lạt,5
"Khách sạn, nhà hàng số 1 cho sự lựa chọn khi đến Đà Nẵng.",5
"Khi có dịp sẽ ghé lại, rất cám ơn resort nhiều",5
Khoảng thời gian thư giãn tuyệt đối.,5
Khoảng thời gian tuyệt vời,5
khoảng thời gian vui vẻ cùng gia đình,5
Không bao giờ đặt phòng tiêu chuẩn tầng hầm cho kỳ nghỉ,2
Không có,2
"Không có gì để phàn nàn, quá chuẩn luôn, phòng ốc sạch sẽ, nhân viên thân thiện nhiệt tình, đáng yêu",5
Không gian đảo biệt lập,5
Không gian đẳng cấp và ven toàn Đà Lạt xưa,5
không gian đẹp,5
Không gian đẹp thích hợp cho nghỉ dưỡng”,5
Không gian khách sạn,5
"Không gian khoáng đạt, nơi ""cởi trói"" tuyệt vời sau những ngày ""sống nhanh"" nơi thành phố",5
"không gian lãng mạn, bãi biển đẹp và thơ mộng giữa núi và biển.",5
"Không gian quá đẹp để tận hưởng không khí mát lạnh của hồ tuyền lâm, rừng thông, và cả khuôn viên khách sạn",5
"Không gian rộng, thoáng, đẹp tuy nhiên dịch vụ ngừng hơi sớm",4
"Không gian thoải mái, đẹp, ngắm cảnh kết hợp thể thao, nhân viên rất thân thiện",5
Không gian thoáng đãng,5
"Không gian thoáng, cảnh đẹp,gần Thiền viện Trúc Lâm",5
"Không gian thoáng, sạch sẽ, phục vụ ăn sáng rất đa dạng",5
Không gian tuyệt vời,5
Không gian tuyệt vời cho gia đình và cặp đôi,5
"Không gian và hỗ trợ nvien rất tốt, resort sạch sẽ yên tĩnh.",5
Không gian văn hóa bắc bộ rất tự nhiên.,5
"không gian xanh, sang trọng",5
"Không gian yên tĩnh, đồ ăn ngon",5
"Không gian yên tĩnh, sạch đẹp",5
"Không gian yên tĩnh, thoải mái",5
Không khí trong lành giữa trung tâm thành phố,5
Không làm mình thất vọng,5
Không nên chọn tầng hầm vì không có view,2
Không quá xa trung tâm mà vẫn biệt lập và yên tĩnh.,5
Không thể tuyệt vời hơn.,5
Không thích hợp cho gia đình có trẻ nhỏ,5
Khu cảnh khách sạn rất đẹp,5
Khu du lịch nghỉ dưỡng an lành,5
Khu nghỉ dưỡng cao cấp tại Vịnh Hạ Long,5
Khu nghỉ dưỡng đẹp với hồ bơi và bãi biển tuyệt vời,5
Khu nghỉ dưỡng lãng mạn và tuyệt vời,5
"Khu nghỉ dưỡng lâu đời, thú vị và bình yên",5
Khu nghỉ dưỡng lý tưởng,5
Khu nghỉ dưỡng năm ngay trung tâm thành phố,5
Khu nghỉ dưỡng siêu đẹp,5
Khu nghỉ dưỡng tuyệt vời,5
Khu nghỉ dưỡng yên bình không náo nhiệt,5
"Khu nghỉ dưỡng yên bình, thơ mộng.",5
Khu nghỉ dưỡng yên tĩnh tuyệt mỹ,5
Khu nghỉ dưỡng yên tĩnh và tiện nghi,5
"Khu nghỉ đẹp, yên tĩnh, rất phù hợp với việc nghỉ dưỡng.",5
Khu nghỉ rất đẹp,5
"Khu nghỉ rộng, thích hợp nghỉ dưỡng",5
"Khu nghỉ tốt, quay lại lần sau",4
"Khu resort cảnh đẹp, cách âm kém",2
Khu resort tuyệt vời nhất Nha Trang,5
Khu resort tuyệt vời,4
"khung cảnh đẹp, nhân viên chuyên nghiệp",4
"Khung cảnh đẹp, phòng đẹp, dịch vụ ổn",4
"Khung cảnh thoáng mát, yên tĩnh thích hợp cho nghỉ dưỡng",4
khuôn viên đẹp,4
Khuôn viên đẹp nhưng đồ dùng trong phòng hơi cũ,2
Khuôn viên đẹp thiếu yên tĩnh,4
"Khuôn viên đẹp, nhân viên chu đáo",5
Khuôn viên đẹp. ăn sáng ngon đa dạng,5
"Khuôn viên được decor đẹp, chăm sóc tốt",5
"Khuôn viên được trang trí đẹp, chăm sóc tốt",5
khuôn viên khách sạn đẹp,5
Khuôn viên khách sạn khá lãng mạn,5
Khuôn viên tuyệt vời,5
Kì nghỉ công tác kết hợp với gia đình,5
Kì nghỉ đông gần nhà,5
Kì nghỉ hè vui vẻ,5
Kì nghỉ không thể tuyệt vời hơn,5
Kì nghỉ thư giãn,5
Kì nghỉ thư giãn và tuyệt vời,5
Kỉ niệm cùng các bạn nơi đảo Rều thân yêu,5
Kỉ niệm đáng nhớ cùng bạn gái,5
Kỉ niệm đẹp trong tôi,5
Kỉ niệm gia đình đến vinpearl,3
Kỉ niệm giữa tuần,3
Kỉ niệm lần đầu tại Vinpearl,3
Ki niệm ngày cưới,3
Kid Club vui chơi tuyệt vời,5
Kids Club có nhiều trò chơi thật tuyệt vời,5
Kids club rất vui cho các bé,5
kiến trúc đẹp. không gian rộng.,5
Kiến trúc mang phong cách Đông Dương,5
Kỳ kỷ niệm ngày cưới đáng nhớ,5
Kỳ nghỉ,3
kỳ nghỉ của mình rất tuyệt vời,5
Kỳ nghỉ dưỡng cùng gia đình trở nên hoàn hảo vì được ở nơi đây,5
Kỳ nghỉ dưỡng đáng nhớ,5
Kỳ nghỉ dưỡng hài lòng,5
Kỳ nghỉ dưỡng thú vị,5
Kỳ nghỉ dưỡng tuyệt vời,5
Kỳ nghỉ dưỡng vui vẻ,5
Kỳ nghỉ dưỡng ý nghĩa,5
Kỳ nghỉ đáng nhớ,5
Kỳ nghỉ đáng nhớ bên gia đình,5
Kỳ nghỉ đáng nhớ cho ngày kỷ niệm cặp đôi,5
Kỳ nghỉ đáng nhớ của tôi cùng các bạn,5
Kỳ nghỉ đáng nhớ cùng người thương,5
Kỳ nghỉ đáng nhớ cùng người yêu,5
Kỳ nghỉ đáng nhớ với dịch vụ đẳng cấp 5 sao,5
Kỳ nghỉ đáng nhớ!,5
Kỳ nghỉ đầu tiên cùng gia đình tại Vinpearl,3
Kỳ nghỉ đông gần nhà,3
Kỳ nghỉ đông hạnh phúc,3
Kỳ nghỉ đường hài lòng,3
Kỳ nghỉ gia đình,3
kỳ nghỉ gia đình tuyệt vời !,5
kỳ nghỉ gia đình.,3
Kỳ nghỉ giáng sinh tuyệt vời,5
Kỳ nghỉ Halloween cùng gia đình,3
Kỳ nghỉ hàng năm,3
Kỳ nghỉ hạnh phúc,3
Kỳ nghỉ hè của gia đình tôi tại đây rất hài lòng,3
Kỳ nghỉ hè đáng nhớ bên gia đình,3
"Kỳ nghỉ hè tuyệt vời và đáng nhớ, sẽ quay lại .",5
Kỳ nghỉ hè vui vẻ,4
Kỳ nghỉ hoàn hảo,5
Kỳ nghỉ hợp lý,4
kỳ nghỉ khá thoải mái vui vẻ,4
Kỳ nghỉ khá thú vị,4
Kỳ nghỉ khó quên,4
Kỳ nghỉ không thể nào quên,4
Kỳ nghỉ kỷ niệm nhân dịp valentine,3
Kỳ nghỉ lãng mạn,3
Kỳ nghỉ lần thứ hai,3
Kỳ nghỉ lễ tết nguyên đán,3
Kỳ nghỉ lễ tuyệt vời,3
Kỳ nghỉ lý tưởng,3
Kỳ nghỉ mát cùng với gia đình,3
Kỳ nghỉ ngắn hạn,3
Kỳ nghỉ ngắn ngày,3
Kỳ nghỉ ngắn ngủi nhưng đáng nhớ,4
Kỳ nghỉ ngắn tuyệt vời,5
Kỳ nghỉ nhiều cảm xúc,5
Kỳ nghỉ Noel đáng nhớ,5
kỳ nghỉ OK,5
Kỳ nghỉ Paradise Suite ấm áp và thoải mái,5
kỳ nghỉ quá thoải mái luôn,5
Kỳ nghỉ quá tuyệt vời,5
Kỳ nghỉ quá vui,5
kỳ nghỉ rất có giá trị,5
kỳ nghỉ rất thoải mái,5
Kỳ nghỉ rất tuyệt,5
Kỳ nghỉ rất tuyệt vời,5
Kỳ nghỉ rất vui,5
Kỳ nghỉ sinh Nhật cùng gia đình,5
Kỳ nghỉ thật tuyệt vời,5
Kỳ nghỉ thoải mái dễ chịu,5
Kỳ nghỉ thú vị và lãng mạn trên đảo rều Vinpearl,5
Kỳ nghỉ thư giãn,4
kỳ nghỉ tốt,4
Kỳ nghỉ tốt đẹp,4
"kỳ nghỉ tốt đẹp, tôi thích nó",4
Kỳ nghỉ tốt đẹp!,4
Kỳ nghỉ tránh dịch,4
Kỳ nghỉ trăng mật.,4
Kỳ nghỉ trọn vẹn,4
Kỳ nghỉ trọn vẹn bên gia đình,4
Kỳ nghỉ tuần trăng mật,4
Kỳ nghỉ Tuần trăng mật tại quê nhà,4
Kỳ nghỉ tuyệt vời cho gia đình có trẻ nhỏ,5
Kỳ nghỉ tuyệt vời của con,5
Kỳ nghỉ tuyệt vời cùng bạn bè!,5
Kỳ nghỉ tuyệt vời cùng các bạn,5
Kỳ nghỉ tuyệt vời nhất,5
Kỳ nghỉ tuyệt vời nhất từng đi,5
Kỳ nghỉ tuyệt vời ở Nha Trang Bay,5
Kỳ nghỉ tuyệt vời trước tết nguyên đán 2021,5
"Kỳ nghỉ tuyệt vời và đáng nhớ,",5
Kỳ nghỉ tuyệt vời với đồng nghiệp,5
Kỳ nghỉ tuyệt vời với gia đình,5
Kỳ nghỉ tuyệt vời với mẹ,5
"Kỳ nghỉ tuyệt vời, không khí trong lành, không gian yên tĩnh; phù hợp cho nghỉ dưỡng",5
"Kỳ nghỉ tuyệt vời, tuy nhiên cần cải thiện nhà hàng",5
Kỳ nghỉ tươi đẹp,5
Kỳ nghỉ với bạn,3
Kỳ nghỉ với bạn trai,3
Kỳ nghỉ với gia đình,3
Kỳ nghỉ vui vẻ,4
Kỳ nghỉ vui vẻ cùng đồng đội cũ,4
Kỳ nghỉ vui vẻ cùng gia đình,4
Kỳ nghỉ vui vẻ nhẹ nhàng tại Amiana,4
Kỳ nghỉ vui vẻ với gia đình,4
Kỳ Nghỉ Ý Nghĩa,5
"Kỳ nghỉ yên tĩnh, nạp lại năng lượng",4
"Kỳ nghỉ, trải nghiệm tuyệt vời",4
Kỷ niệm 1 năm,3
Kỷ niệm bên Bạn bè,3
Kỷ niệm đáng nhớ tại Vinpearl Nha Trang Bay,4
Kỷ niệm đẹp tại Vinpearl,4
Kỷ niệm kẹp tại Vinpearl,4
Kỷ niệm ngày cưới,3
Kỳ trải nghiệm tuyệt vời cùng những người bạn.,5
Là 1 trong những trải nghiệm đáng mong đợi.,5
Là một nơi lý tưởng để nghỉ dưỡng,5
Là nơi lý tưởng đáng để ở,5
Là nơi nghỉ dưỡng tốt,5
Là nơi tuyệt vời.,5
Làm tốt lắm,4
Làm tốt lắm các bạn,4
Lãng mạn,4
Lần đầu cho bé hạ thuỷ - kỷ niệm đẹp,3
Lần đầu đến khách sạn 5 sao tôi cảm thấy rất hài lòng,5
Lần đầu đến và rất hài lòng,5
Lần đầu làm chuyện ấy,3
Lần đầu trải nghiệm dịch vụ,3
Lần đầu trải nghiệm dịch vụ la vela sài gòn,3
Lần đầu trải nghiệm dịch vụ tại Vin,3
Lần đầu trải nghiệm dịch vụ Vinpearl,3
Lần đầu trải nghiệm và rất hài lòng luôn,5
Lâu rồi mới quay lại Vinpearl,4
Lịch sự,4
Lịch sự và chu đáo,5
Lịch sự và tử tế,5
"Lịch sự, thân thiện và chu đáo",5
"Lịch sự, thoải mái, buffet ngon",5
Liên hoan công ty,3
loại hình hotel mới thú vị,4
Loại phòng và dịch vụ,3
Lobby bar đẳng cấp 5 sao tại Sheraton Nha Trang,5
Lời cảm ơn,3
Lời cảm ơn dành cho Hon Tam,4
luôn chọn Sheraton là nơi nghỉ ngơi mỗi khi đi du lịch cùng gia đình,4
Luôn là lựa chọn của tôi,4
Luôn là lựa chọn hợp lý nhất !,4
Lựa chọn đầu tiên cho kỳ nghỉ tại Đà Nẵng,4
Lựa chọn đúng đắn,4
Lựa chọn nghỉ dưỡng mới mà không phải đi xa cho người dân miền Bắc,4
Lựa chọn phù hợp cho một chuyến nghỉ dưỡng,4
Lựa chọn tốt,4
Lựa chọn tốt cho du lịch nhóm hoặc cặp đôi,4
Lựa chọn tốt khi ở Đà Lạt,4
Lựa chọn tốt nhất tại thủ đô,4
"Lựa chọn tốt, đáng để quay lại",4
Lựa chọn tuyệt vời,5
mãi mãi yêu,4
Mê,4
Mến Thương Nơi Đây,4
"Miễn chê, Trên cả tuyệt vời",5
"Mình có trải nghiệm tốt, tuy nhiên sẽ hoàn hảo nếu cải thiện được những điều trên.",4
Mình đã có 1 trải nghiệm không vui tại đây,5
Mình đã có trải nghiệm rất tốt tại Zen Valley,5
"Mình đánh giá cao phần nhân viên, thật sự dễ thương và chu
đáo.",5
"Mình rất hài lòng khi lưu trú tại Terracotta sau vài lần bỏ lỡ, nơi lý tưởng để nghỉ dưỡng, muốn lên trung tâm để ăn uống",5
Mình rất hài lòng về Amiana,5
Mình rất hài lòng về kỳ nghỉ,5
Mình rất thích Navada,5
Mình sẽ đến vào lần sau,4
Mình sẽ quay lại,4
Mọi người nên trải nghiệm khách sạn khi đến với Hạ Long,4
"mọi người thân thiện, dịch vụ tốt",5
Mọi thứ đều đúng như quảng cáo.,5
Mọi thứ đều hài lòng,5
Mọi thứ đều ok,5
"Mọi thứ đều ok trừ điểm tâm sáng và vấn đề nhà tắm và nhà vệ sinh",5
Mọi thứ đều ổn,4
Mọi thứ đều ổn trừ bãi đậu xe ô tô,5
Mọi thứ đều rất tốt,5
Mọi thứ đều rất tuyệt khung cảnh tới nhân viên ở đây quá tinh tế tuyệt vời.,5
"Mọi thứ đều rất tuyệt, phục vụ rất tốt, cảnh tuyệt đẹp, phòng đẹp",5
Mọi thứ đều tốt,5
Mọi thứ đều tuyệt,5
Mọi thứ đều tuyệt nhưng vị trí không thuận lợi,5
Mọi thứ đều tương đối tốt,5
Mọi thứ ok,5
Mọi thứ quá tuyệt vời!,5
Mọi thứ rất tuyệt,5
"Mọi thứ sẽ hoàn hảo nếu như không bị quá phiền phức với phòng đối diện có vài trẻ nhỏ",2
Mọi thứ thật tuyệt vời,5
"Mọi thứ tốt và dĩ nhiên tôi sẽ chọn nơi đây cho kỳ lưu trú sắp tới",5
"Mọi thứ tuyệt vời, cảnh Hồ Tuyền Lâm thơ mộng",5
"Mọi thứ tuyệt vời, khung cảnh đẹp.",5
Mọi tiện nghi đều rất tuyệt vời,5
Mọi tiện nghi đều sử dụng được,4
Mong có dịp quay lại.,4
"Mong rằng nước thải ra biển được cải thiện hoặc thanh lọc tốt hơn khi Thải ra biển",2
"Mỗi lần đến Nha Trang tôi đều chọn Spa Sheraton Nha Trang để ở, và tôi luôn có cảm giác như được trở về nhà.",5
Một ấn tượng khó quên,5
Một buổi đi chơi cùng bạn,3
Một buổi hẹn ở skybar,3
Một buổi tối ấm áp bên gia đình,4
Một buổi tối tuyệt vời tại La Vela,5
Một buổi tối vui vẻ,4
Một buổi trưa tuyệt vời cùng gia đình,5
Một bữa tiệc tuyệt vời cùng đồng nghiệp tại MERMAID,5
Một bữa tối ấm cúm tại Lavela,4
Một bữa tối cuối tuần lãng mạn,5
Một cảm giác tuyệt vời cho kì tầng trăng mật,5
Một chút thất vọng,5
"Một chuyến du lịch Nha Trang đầy thú vị, và một trải nghiệm nghỉ dưỡng tuyệt vời",5
Một chuyến du lịch tuyệt vời,5
Một chuyến đi chơi xa,3
Một chuyến đi cực chill và vui vẻ.,5
Một chuyến đi đáng nhớ,5
Một chuyến đi đáng nhớ kỷ niệm 5 năm ngày cưới,5
Một chuyến đi đẹp.,5
Một chuyến đi nghỉ tuyệt vời,5
Một chuyến đi thật tuyệt vời cùng dịch vụ rất ok,5
Một chuyến nghỉ dưỡng thật tuyệt vời,5
Một đêm nghỉ dưỡng thư giãn và thoải mái,5
Một địa điểm đáng trải nghiệm,5
Một địa điểm đẹp,5
Một địa điểm nhất định phải check in ở Đà Lạt,5
một địa điểm sống ảo thú vị,5
Một địa điểm tốt để tổ chức Hội thảo,5
Một địa điểm tuyệt vời,5
